application_row_id,application_id,raw_processing_timestamp,raw_applicant_full_name,raw_applicant_email,raw_applicant_ssn,raw_applicant_ip_address,raw_applicant_gender,raw_applicant_date_of_birth,raw_applicant_zip_code,raw_financial_annual_income,raw_financial_annual_salary,raw_financial_credit_history_months,raw_financial_debt_to_income,raw_financial_savings_balance,raw_decision_loan_approved,raw_decision_interest_rate,raw_decision_approved_amount,raw_decision_rejection_reason,raw_loan_purpose,raw_notes,clean_email,blank_email_flag,has_invalid_email,clean_gender,gender_missing_flag,gender_invalid_flag,gender_normalized_flag,clean_date_of_birth,dob_ambiguous_flag,dob_parse_failed_flag,dob_missing_flag,clean_zip_code,zip_missing_flag,clean_processing_timestamp,processing_timestamp_parse_failed_flag,annual_income_from_salary_flag,annual_income_source,clean_annual_income,annual_income_coerce_failed_flag,annual_income_missing_flag,credit_history_non_numeric_flag,credit_history_negative_flag,credit_history_nullified_flag,clean_credit_history_months,dti_non_numeric_flag,dti_out_of_range_flag,dti_nullified_flag,clean_debt_to_income,savings_non_numeric_flag,savings_negative_flag,savings_nullified_flag,clean_savings_balance,clean_loan_approved,clean_interest_rate,clean_approved_amount,clean_rejection_reason,approved_missing_fields_flag,rejected_missing_reason_flag,approved_with_zero_credit_history_flag,approved_with_lt6_credit_history_flag,flag_missing_processing_timestamp,flag_missing_required_applicant_field,flag_missing_ssn_and_ip,flag_blank_email,flag_invalid_email,flag_gender_needs_normalisation,flag_invalid_gender,flag_dob_non_iso_format,flag_dob_ambiguous_format,flag_annual_income_string_type,flag_financial_field_drift_salary,flag_credit_history_negative,flag_savings_negative,flag_dti_out_of_range,flag_approved_missing_required_fields,flag_rejected_missing_reason,flag_approved_credit_history_zero,flag_approved_credit_history_lt6,flag_private_ip_address,is_duplicate_id,dup_count,rank_within_id,is_canonical_for_analysis,has_conflict,duplicate_classification,canonical_reason
0,app_200,2024-01-15T00:00:00Z,Jerry Smith,jerry.smith17@hotmail.com,596-64-4340,192.168.48.155,Male,2001-03-09,10036,73000,,23,0.2,31212,False,,,algorithm_risk_score,,,jerry.smith17@hotmail.com,False,False,Male,False,False,False,2001-03-09,False,False,False,10036,False,2024-01-15T00:00:00Z,False,False,annual_income,73000.0,False,False,False,False,False,23,False,False,False,0.2,False,False,False,31212.0,False,,,algorithm_risk_score,False,False,False,False,False,False,False,False,False,False,False,False,False,False,False,False,False,False,False,False,False,False,True,False,1,1,True,False,unique,latest_processing_timestamp
1,app_037,,Brandon Walker,brandon.walker2@yahoo.com,425-69-4784,10.1.102.112,M,1992-03-31,10032,78000,,51,0.18,17915,False,,,algorithm_risk_score,,,brandon.walker2@yahoo.com,False,False,Male,False,False,True,1992-03-31,False,False,False,10032,False,,False,False,annual_income,78000.0,False,False,False,False,False,51,False,False,False,0.18,False,False,False,17915.0,False,,,algorithm_risk_score,False,False,False,False,True,False,False,False,False,True,False,False,False,False,False,False,False,False,False,False,False,False,True,False,1,1,True,False,unique,missing_or_unparseable_timestamp_fallback_max_row_id
2,app_215,,Scott Moore,scott.moore94@mail.com,370-78-5178,10.240.193.250,Male,1989-10-24,10075,61000,,41,0.21,37909,True,3.7,59000.0,,vacation,,scott.moore94@mail.com,False,False,Male,False,False,False,1989-10-24,False,False,False,10075,False,,False,False,annual_income,61000.0,False,False,False,False,False,41,False,False,False,0.21,False,False,False,37909.0,True,3.7,59000.0,,False,False,False,False,True,False,False,False,False,False,False,False,False,False,False,False,False,False,False,False,False,False,True,False,1,1,True,False,unique,missing_or_unparseable_timestamp_fallback_max_row_id
3,app_024,,Thomas Lee,thomas.lee6@protonmail.com,194-35-1833,192.168.175.67,Male,1983-04-25,10077,103000,,70,0.35,0,True,4.3,34000.0,,,,thomas.lee6@protonmail.com,False,False,Male,False,False,False,1983-04-25,False,False,False,10077,False,,False,False,annual_income,103000.0,False,False,False,False,False,70,False,False,False,0.35,False,False,False,0.0,True,4.3,34000.0,,False,False,False,False,True,False,False,False,False,False,False,False,False,False,False,False,False,False,False,False,False,False,True,False,1,1,True,False,unique,missing_or_unparseable_timestamp_fallback_max_row_id
4,app_184,2024-01-15T00:00:00Z,Brian Rodriguez,brian.rodriguez86@aol.com,480-41-2475,172.29.125.105,M,1999-05-21,10080,57000,,14,0.23,31763,False,,,algorithm_risk_score,,,brian.rodriguez86@aol.com,False,False,Male,False,False,True,1999-05-21,False,False,False,10080,False,2024-01-15T00:00:00Z,False,False,annual_income,57000.0,False,False,False,False,False,14,False,False,False,0.23,False,False,False,31763.0,False,,,algorithm_risk_score,False,False,False,False,False,False,False,False,False,True,False,False,False,False,False,False,False,False,False,False,False,False,True,False,1,1,True,False,unique,latest_processing_timestamp
5,app_275,,Maria Miller,maria.miller67@outlook.com,417-25-4912,172.25.58.70,F,14/02/1982,10019,110000,,33,0.05,49933,False,,,algorithm_risk_score,,,maria.miller67@outlook.com,False,False,Female,False,False,True,1982-02-14,False,False,False,10019,False,,False,False,annual_income,110000.0,False,False,False,False,False,33,False,False,False,0.05,False,False,False,49933.0,False,,,algorithm_risk_score,False,False,False,False,True,False,False,False,False,True,False,True,False,False,False,False,False,False,False,False,False,False,True,False,1,1,True,False,unique,missing_or_unparseable_timestamp_fallback_max_row_id
6,app_099,,Nicholas King,nicholas.king46@outlook.com,613-23-2503,10.62.62.45,Male,28/01/1990,10022,55000,,61,0.17,30159,True,5.6,27000.0,,,,nicholas.king46@outlook.com,False,False,Male,False,False,False,1990-01-28,False,False,False,10022,False,,False,False,annual_income,55000.0,False,False,False,False,False,61,False,False,False,0.17,False,False,False,30159.0,True,5.6,27000.0,,False,False,False,False,True,False,False,False,False,False,False,True,False,False,False,False,False,False,False,False,False,False,True,False,1,1,True,False,unique,missing_or_unparseable_timestamp_fallback_max_row_id
7,app_246,,Susan Rivera,susan.rivera74@gmail.com,176-97-1864,192.168.158.59,F,1991-10-11,90223,82000,,31,0.29,21809,True,2.8,38000.0,,auto,,susan.rivera74@gmail.com,False,False,Female,False,False,True,1991-10-11,False,False,False,90223,False,,False,False,annual_income,82000.0,False,False,False,False,False,31,False,False,False,0.29,False,False,False,21809.0,True,2.8,38000.0,,False,False,False,False,True,False,False,False,False,True,False,False,False,False,False,False,False,False,False,False,False,False,True,False,1,1,True,False,unique,missing_or_unparseable_timestamp_fallback_max_row_id
8,app_042,,Joseph Lopez,joseph.lopez1@gmail.com,652-70-5530,192.168.91.142,Male,1990-05-04,10044,69000,,43,0.41,15974,False,,,algorithm_risk_score,,,joseph.lopez1@gmail.com,False,False,Male,False,False,False,1990-05-04,False,False,False,10044,False,,False,False,annual_income,69000.0,False,False,False,False,False,43,False,False,False,0.41,False,False,False,15974.0,False,,,algorithm_risk_score,False,False,False,False,True,False,False,False,False,False,False,False,False,False,False,False,False,False,False,False,False,False,True,True,2,1,False,False,versioned,missing_or_unparseable_timestamp_fallback_max_row_id
9,app_348,,Michael Mitchell,michael.mitchell42@hotmail.com,100-94-8400,172.28.12.121,Male,1989-10-10,10080,55000,,5,0.41,13794,False,,,insufficient_credit_history,,,michael.mitchell42@hotmail.com,False,False,Male,False,False,False,1989-10-10,False,False,False,10080,False,,False,False,annual_income,55000.0,False,False,False,False,False,5,False,False,False,0.41,False,False,False,13794.0,False,,,insufficient_credit_history,False,False,False,False,True,False,False,False,False,False,False,False,False,False,False,False,False,False,False,False,False,False,True,False,1,1,True,False,unique,missing_or_unparseable_timestamp_fallback_max_row_id
10,app_309,,Patricia Carter,patricia.carter75@gmail.com,392-82-4407,192.168.231.120,Female,1970-10-01,90250,63000,,99,0.37,21769,True,5.1,72000.0,,,,patricia.carter75@gmail.com,False,False,Female,False,False,False,1970-10-01,False,False,False,90250,False,,False,False,annual_income,63000.0,False,False,False,False,False,99,False,False,False,0.37,False,False,False,21769.0,True,5.1,72000.0,,False,False,False,False,True,False,False,False,False,False,False,False,False,False,False,False,False,False,False,False,False,False,True,False,1,1,True,False,unique,missing_or_unparseable_timestamp_fallback_max_row_id
11,app_320,,Jason Brown,jason.brown65@icloud.com,222-48-1592,192.168.52.13,Male,01/12/1978,90286,168000,,58,0.35,13088,True,5.9,71000.0,,,,jason.brown65@icloud.com,False,False,Male,False,False,False,1978-01-12,True,False,False,90286,False,,False,False,annual_income,168000.0,False,False,False,False,False,58,False,False,False,0.35,False,False,False,13088.0,True,5.9,71000.0,,False,False,False,False,True,False,False,False,False,False,False,True,True,False,False,False,False,False,False,False,False,False,True,False,1,1,True,False,unique,missing_or_unparseable_timestamp_fallback_max_row_id
12,app_007,,Emma Clark,emma.clark14@protonmail.com,191-40-8079,192.168.11.34,Female,1989-06-13,90284,92000,,77,0.08,21353,True,5.2,27000.0,,,,emma.clark14@protonmail.com,False,False,Female,False,False,False,1989-06-13,False,False,False,90284,False,,False,False,annual_income,92000.0,False,False,False,False,False,77,False,False,False,0.08,False,False,False,21353.0,True,5.2,27000.0,,False,False,False,False,True,False,False,False,False,False,False,False,False,False,False,False,False,False,False,False,False,False,True,False,1,1,True,False,unique,missing_or_unparseable_timestamp_fallback_max_row_id
13,app_439,,Benjamin Jackson,benjamin.jackson34@gmail.com,807-60-7784,192.168.98.253,Male,1976-04-19,10019,87000,,72,0.12,50675,True,4.2,61000.0,,,,benjamin.jackson34@gmail.com,False,False,Male,False,False,False,1976-04-19,False,False,False,10019,False,,False,False,annual_income,87000.0,False,False,False,False,False,72,False,False,False,0.12,False,False,False,50675.0,True,4.2,61000.0,,False,False,False,False,True,False,False,False,False,False,False,False,False,False,False,False,False,False,False,False,False,False,True,False,1,1,True,False,unique,missing_or_unparseable_timestamp_fallback_max_row_id
14,app_307,,Joseph Lee,joseph.lee69@aol.com,178-35-6543,10.189.246.72,M,1990/07/26,10097,53000,,83,0.1,17420,True,6.1,57000.0,,,,joseph.lee69@aol.com,False,False,Male,False,False,True,1990-07-26,False,False,False,10097,False,,False,False,annual_income,53000.0,False,False,False,False,False,83,False,False,False,0.1,False,False,False,17420.0,True,6.1,57000.0,,False,False,False,False,True,False,False,False,False,True,False,True,False,False,False,False,False,False,False,False,False,False,True,False,1,1,True,False,unique,missing_or_unparseable_timestamp_fallback_max_row_id
15,app_064,,Paul Martin,paul.martin91@yahoo.com,500-65-1608,192.168.73.18,Male,1992-06-22,10009,81000,,64,0.37,40674,False,,,algorithm_risk_score,,,paul.martin91@yahoo.com,False,False,Male,False,False,False,1992-06-22,False,False,False,10009,False,,False,False,annual_income,81000.0,False,False,False,False,False,64,False,False,False,0.37,False,False,False,40674.0,False,,,algorithm_risk_score,False,False,False,False,True,False,False,False,False,False,False,False,False,False,False,False,False,False,False,False,False,False,True,False,1,1,True,False,unique,missing_or_unparseable_timestamp_fallback_max_row_id
16,app_101,,Sandra Smith,sandra.smith99@icloud.com,937-72-8731,172.30.237.98,Female,1997-03-23,90255,55000,,0,0.3,15364,False,,,algorithm_risk_score,,,sandra.smith99@icloud.com,False,False,Female,False,False,False,1997-03-23,False,False,False,90255,False,,False,False,annual_income,55000.0,False,False,False,False,False,0,False,False,False,0.3,False,False,False,15364.0,False,,,algorithm_risk_score,False,False,False,False,True,False,False,False,False,False,False,False,False,False,False,False,False,False,False,False,False,False,True,False,1,1,True,False,unique,missing_or_unparseable_timestamp_fallback_max_row_id
17,app_133,,Frank Harris,frank.harris11@outlook.com,507-24-3732,172.25.65.254,Male,1989-10-07,10022,70000,,72,0.16,33883,False,,,algorithm_risk_score,,,frank.harris11@outlook.com,False,False,Male,False,False,False,1989-10-07,False,False,False,10022,False,,False,False,annual_income,70000.0,False,False,False,False,False,72,False,False,False,0.16,False,False,False,33883.0,False,,,algorithm_risk_score,False,False,False,False,True,False,False,False,False,False,False,False,False,False,False,False,False,False,False,False,False,False,True,False,1,1,True,False,unique,missing_or_unparseable_timestamp_fallback_max_row_id
18,app_214,,Christine Miller,christine.miller65@mail.com,929-57-7649,172.17.208.126,Female,1962-08-26,90277,116000,,84,0.31,41962,True,4.1,57000.0,,debt_consolidation,,christine.miller65@mail.com,False,False,Female,False,False,False,1962-08-26,False,False,False,90277,False,,False,False,annual_income,116000.0,False,False,False,False,False,84,False,False,False,0.31,False,False,False,41962.0,True,4.1,57000.0,,False,False,False,False,True,False,False,False,False,False,False,False,False,False,False,False,False,False,False,False,False,False,True,False,1,1,True,False,unique,missing_or_unparseable_timestamp_fallback_max_row_id
19,app_078,,Rebecca Wilson,rebecca.wilson4@gmail.com,854-84-6365,172.30.31.154,Female,1997-02-25,90299,47000,,19,0.26,14054,False,,,insufficient_credit_history,,,rebecca.wilson4@gmail.com,False,False,Female,False,False,False,1997-02-25,False,False,False,90299,False,,False,False,annual_income,47000.0,False,False,False,False,False,19,False,False,False,0.26,False,False,False,14054.0,False,,,insufficient_credit_history,False,False,False,False,True,False,False,False,False,False,False,False,False,False,False,False,False,False,False,False,False,False,True,False,1,1,True,False,unique,missing_or_unparseable_timestamp_fallback_max_row_id
20,app_317,,Stephen Mitchell,stephen.mitchell26@yahoo.com,805-56-9241,172.16.60.139,Male,1981-10-27,10057,45000,,105,0.22,19039,True,4.9,80000.0,,,,stephen.mitchell26@yahoo.com,False,False,Male,False,False,False,1981-10-27,False,False,False,10057,False,,False,False,annual_income,45000.0,False,False,False,False,False,105,False,False,False,0.22,False,False,False,19039.0,True,4.9,80000.0,,False,False,False,False,True,False,False,False,False,False,False,False,False,False,False,False,False,False,False,False,False,False,True,False,1,1,True,False,unique,missing_or_unparseable_timestamp_fallback_max_row_id
21,app_173,2024-01-15T00:00:00Z,Sarah Hall,sarah.hall95@hotmail.com,131-14-4051,10.168.245.226,Female,18/07/1979,90277,115000,,60,0.05,62581,False,,,algorithm_risk_score,,,sarah.hall95@hotmail.com,False,False,Female,False,False,False,1979-07-18,False,False,False,90277,False,2024-01-15T00:00:00Z,False,False,annual_income,115000.0,False,False,False,False,False,60,False,False,False,0.05,False,False,False,62581.0,False,,,algorithm_risk_score,False,False,False,False,False,False,False,False,False,False,False,True,False,False,False,False,False,False,False,False,False,False,True,False,1,1,True,False,unique,latest_processing_timestamp
22,app_352,,Deborah Miller,deborah.miller59@aol.com,514-30-3461,10.149.249.118,F,1961-11-04,90209,104000,,110,0.32,25826,True,4.4,58000.0,,,,deborah.miller59@aol.com,False,False,Female,False,False,True,1961-11-04,False,False,False,90209,False,,False,False,annual_income,104000.0,False,False,False,False,False,110,False,False,False,0.32,False,False,False,25826.0,True,4.4,58000.0,,False,False,False,False,True,False,False,False,False,True,False,False,False,False,False,False,False,False,False,False,False,False,True,False,1,1,True,False,unique,missing_or_unparseable_timestamp_fallback_max_row_id
23,app_289,,Alexander Thompson,alexander.thompson21@mail.com,161-62-3645,10.115.225.196,M,20/04/1979,10080,77000,,93,0.42,33650,True,4.1,29000.0,,,,alexander.thompson21@mail.com,False,False,Male,False,False,True,1979-04-20,False,False,False,10080,False,,False,False,annual_income,77000.0,False,False,False,False,False,93,False,False,False,0.42,False,False,False,33650.0,True,4.1,29000.0,,False,False,False,False,True,False,False,False,False,True,False,True,False,False,False,False,False,False,False,False,False,False,True,False,1,1,True,False,unique,missing_or_unparseable_timestamp_fallback_max_row_id
24,app_458,,Frank Rivera,frank.rivera78@gmail.com,493-26-1934,192.168.143.14,Male,1978-02-16,10006,90000,,45,0.37,28672,True,4.3,45000.0,,,,frank.rivera78@gmail.com,False,False,Male,False,False,False,1978-02-16,False,False,False,10006,False,,False,False,annual_income,90000.0,False,False,False,False,False,45,False,False,False,0.37,False,False,False,28672.0,True,4.3,45000.0,,False,False,False,False,True,False,False,False,False,False,False,False,False,False,False,False,False,False,False,False,False,False,True,False,1,1,True,False,unique,missing_or_unparseable_timestamp_fallback_max_row_id
25,app_080,,James Torres,james.torres4@yahoo.com,951-51-4647,10.222.104.77,M,1989-08-01,10075,111000,,58,0.39,18138,True,3.1,37000.0,,,,james.torres4@yahoo.com,False,False,Male,False,False,True,1989-08-01,False,False,False,10075,False,,False,False,annual_income,111000.0,False,False,False,False,False,58,False,False,False,0.39,False,False,False,18138.0,True,3.1,37000.0,,False,False,False,False,True,False,False,False,False,True,False,False,False,False,False,False,False,False,False,False,False,False,True,False,1,1,True,False,unique,missing_or_unparseable_timestamp_fallback_max_row_id
26,app_075,,Margaret Williams,,,,,,,61000,,29,0.15,25894,True,5.1,22000.0,,,,,True,False,,True,False,False,,False,False,True,,True,,False,False,annual_income,61000.0,False,False,False,False,False,29,False,False,False,0.15,False,False,False,25894.0,True,5.1,22000.0,,False,False,False,False,True,True,True,True,False,False,False,False,False,False,False,False,False,False,False,False,False,False,False,False,1,1,True,False,unique,missing_or_unparseable_timestamp_fallback_max_row_id
27,app_212,,Amy Flores,amy.flores63@outlook.com,654-72-8456,172.17.7.50,Female,1997-12-09,90231,50000,,25,0.2,20787,False,,,algorithm_risk_score,personal,,amy.flores63@outlook.com,False,False,Female,False,False,False,1997-12-09,False,False,False,90231,False,,False,False,annual_income,50000.0,False,False,False,False,False,25,False,False,False,0.2,False,False,False,20787.0,False,,,algorithm_risk_score,False,False,False,False,True,False,False,False,False,False,False,False,False,False,False,False,False,False,False,False,False,False,True,False,1,1,True,False,unique,missing_or_unparseable_timestamp_fallback_max_row_id
28,app_369,,Patricia Nelson,patricia.nelson33@protonmail.com,557-16-4712,172.24.111.38,Female,1985-01-03,90259,102000,,35,0.17,33980,False,,,algorithm_risk_score,,,patricia.nelson33@protonmail.com,False,False,Female,False,False,False,1985-01-03,False,False,False,90259,False,,False,False,annual_income,102000.0,False,False,False,False,False,35,False,False,False,0.17,False,False,False,33980.0,False,,,algorithm_risk_score,False,False,False,False,True,False,False,False,False,False,False,False,False,False,False,False,False,False,False,False,False,False,True,False,1,1,True,False,unique,missing_or_unparseable_timestamp_fallback_max_row_id
29,app_452,,Nancy Young,nancy.young58@protonmail.com,645-69-5977,192.168.219.132,F,1994-03-25,90221,66000,,67,0.07,24654,False,,,algorithm_risk_score,,,nancy.young58@protonmail.com,False,False,Female,False,False,True,1994-03-25,False,False,False,90221,False,,False,False,annual_income,66000.0,False,False,False,False,False,67,False,False,False,0.07,False,False,False,24654.0,False,,,algorithm_risk_score,False,False,False,False,True,False,False,False,False,True,False,False,False,False,False,False,False,False,False,False,False,False,True,False,1,1,True,False,unique,missing_or_unparseable_timestamp_fallback_max_row_id
30,app_127,,Brandon Taylor,brandon.taylor17@yahoo.com,708-16-1511,172.22.250.112,Male,1968-12-30,90261,73000,,78,0.15,28164,True,5.9,53000.0,,,,brandon.taylor17@yahoo.com,False,False,Male,False,False,False,1968-12-30,False,False,False,90261,False,,False,False,annual_income,73000.0,False,False,False,False,False,78,False,False,False,0.15,False,False,False,28164.0,True,5.9,53000.0,,False,False,False,False,True,False,False,False,False,False,False,False,False,False,False,False,False,False,False,False,False,False,True,False,1,1,True,False,unique,missing_or_unparseable_timestamp_fallback_max_row_id
31,app_167,2024-01-15T00:00:00Z,Emma Williams,emma.williams6@icloud.com,406-96-8493,172.31.200.173,F,1983-05-10,90214,105000,,32,0.17,55374,False,,,algorithm_risk_score,,,emma.williams6@icloud.com,False,False,Female,False,False,True,1983-05-10,False,False,False,90214,False,2024-01-15T00:00:00Z,False,False,annual_income,105000.0,False,False,False,False,False,32,False,False,False,0.17,False,False,False,55374.0,False,,,algorithm_risk_score,False,False,False,False,False,False,False,False,False,True,False,False,False,False,False,False,False,False,False,False,False,False,True,False,1,1,True,False,unique,latest_processing_timestamp
32,app_274,,Samantha Williams,samantha.williams57@icloud.com,437-17-2802,10.182.73.70,Female,1986/11/20,90235,89000,,51,0.39,27953,True,5.6,65000.0,,,,samantha.williams57@icloud.com,False,False,Female,False,False,False,1986-11-20,False,False,False,90235,False,,False,False,annual_income,89000.0,False,False,False,False,False,51,False,False,False,0.39,False,False,False,27953.0,True,5.6,65000.0,,False,False,False,False,True,False,False,False,False,False,False,True,False,False,False,False,False,False,False,False,False,False,True,False,1,1,True,False,unique,missing_or_unparseable_timestamp_fallback_max_row_id
33,app_422,,Kathleen Flores,kathleen.flores42@yahoo.com,455-19-2179,192.168.210.173,Female,1981-08-17,90284,108000,,80,0.37,30248,False,,,algorithm_risk_score,,,kathleen.flores42@yahoo.com,False,False,Female,False,False,False,1981-08-17,False,False,False,90284,False,,False,False,annual_income,108000.0,False,False,False,False,False,80,False,False,False,0.37,False,False,False,30248.0,False,,,algorithm_risk_score,False,False,False,False,True,False,False,False,False,False,False,False,False,False,False,False,False,False,False,False,False,False,True,False,1,1,True,False,unique,missing_or_unparseable_timestamp_fallback_max_row_id
34,app_280,,Benjamin Thomas,benjamin.thomas34@icloud.com,235-66-1824,172.17.156.231,Male,1987-02-06,10046,57000,,13,0.24,14728,False,,,insufficient_credit_history,,,benjamin.thomas34@icloud.com,False,False,Male,False,False,False,1987-02-06,False,False,False,10046,False,,False,False,annual_income,57000.0,False,False,False,False,False,13,False,False,False,0.24,False,False,False,14728.0,False,,,insufficient_credit_history,False,False,False,False,True,False,False,False,False,False,False,False,False,False,False,False,False,False,False,False,False,False,True,False,1,1,True,False,unique,missing_or_unparseable_timestamp_fallback_max_row_id
35,app_276,,Sarah Harris,sarah.harris19@icloud.com,965-43-3270,192.168.198.87,F,1995/05/07,90260,30000,,0,0.13,3388,False,,,algorithm_risk_score,,,sarah.harris19@icloud.com,False,False,Female,False,False,True,1995-05-07,False,False,False,90260,False,,False,False,annual_income,30000.0,False,False,False,False,False,0,False,False,False,0.13,False,False,False,3388.0,False,,,algorithm_risk_score,False,False,False,False,True,False,False,False,False,True,False,True,False,False,False,False,False,False,False,False,False,False,True,False,1,1,True,False,unique,missing_or_unparseable_timestamp_fallback_max_row_id
36,app_386,,Angela Carter,angela.carter72@gmail.com,961-42-2857,172.21.133.119,F,03/20/1968,90283,84000,,96,0.35,41312,True,4.7,66000.0,,,,angela.carter72@gmail.com,False,False,Female,False,False,True,1968-03-20,False,False,False,90283,False,,False,False,annual_income,84000.0,False,False,False,False,False,96,False,False,False,0.35,False,False,False,41312.0,True,4.7,66000.0,,False,False,False,False,True,False,False,False,False,True,False,True,False,False,False,False,False,False,False,False,False,False,True,False,1,1,True,False,unique,missing_or_unparseable_timestamp_fallback_max_row_id
37,app_178,2024-01-15T00:00:00Z,Brandon Harris,brandon.harris4@outlook.com,262-63-6057,192.168.200.5,Male,20/07/1997,10027,52000,,44,0.13,20921,True,3.8,44000.0,,,,brandon.harris4@outlook.com,False,False,Male,False,False,False,1997-07-20,False,False,False,10027,False,2024-01-15T00:00:00Z,False,False,annual_income,52000.0,False,False,False,False,False,44,False,False,False,0.13,False,False,False,20921.0,True,3.8,44000.0,,False,False,False,False,False,False,False,False,False,False,False,True,False,False,False,False,False,False,False,False,False,False,True,False,1,1,True,False,unique,latest_processing_timestamp
38,app_441,,Katherine King,katherine.king17@outlook.com,568-34-9570,192.168.25.187,Female,1986-12-05,90268,110000,,20,0.12,23593,True,2.6,74000.0,,,,katherine.king17@outlook.com,False,False,Female,False,False,False,1986-12-05,False,False,False,90268,False,,False,False,annual_income,110000.0,False,False,False,False,False,20,False,False,False,0.12,False,False,False,23593.0,True,2.6,74000.0,,False,False,False,False,True,False,False,False,False,False,False,False,False,False,False,False,False,False,False,False,False,False,True,False,1,1,True,False,unique,missing_or_unparseable_timestamp_fallback_max_row_id
39,app_285,,Elizabeth Garcia,elizabeth.garcia70@mail.com,105-34-6367,192.168.188.222,Female,1987/06/28,90226,75000,,16,0.17,13622,True,2.5,48000.0,,,,elizabeth.garcia70@mail.com,False,False,Female,False,False,False,1987-06-28,False,False,False,90226,False,,False,False,annual_income,75000.0,False,False,False,False,False,16,False,False,False,0.17,False,False,False,13622.0,True,2.5,48000.0,,False,False,False,False,True,False,False,False,False,False,False,True,False,False,False,False,False,False,False,False,False,False,True,False,1,1,True,False,unique,missing_or_unparseable_timestamp_fallback_max_row_id
40,app_232,,Susan Williams,susan.williams56@protonmail.com,990-44-6079,192.168.82.109,Female,1985-03-04,90218,129000,,60,0.1,31187,True,2.8,48000.0,,personal,,susan.williams56@protonmail.com,False,False,Female,False,False,False,1985-03-04,False,False,False,90218,False,,False,False,annual_income,129000.0,False,False,False,False,False,60,False,False,False,0.1,False,False,False,31187.0,True,2.8,48000.0,,False,False,False,False,True,False,False,False,False,False,False,False,False,False,False,False,False,False,False,False,False,False,True,False,1,1,True,False,unique,missing_or_unparseable_timestamp_fallback_max_row_id
41,app_420,,Betty Allen,betty.allen48@gmail.com,543-66-7870,172.24.54.162,Female,1988/04/06,10087,81000,,23,0.14,19007,True,3.4,66000.0,,,,betty.allen48@gmail.com,False,False,Female,False,False,False,1988-04-06,False,False,False,10087,False,,False,False,annual_income,81000.0,False,False,False,False,False,23,False,False,False,0.14,False,False,False,19007.0,True,3.4,66000.0,,False,False,False,False,True,False,False,False,False,False,False,True,False,False,False,False,False,False,False,False,False,False,True,False,1,1,True,False,unique,missing_or_unparseable_timestamp_fallback_max_row_id
42,app_130,,Jennifer Wright,jennifer.wright10@mail.com,286-43-9771,172.27.3.208,Female,03/10/1981,90252,135000,,62,0.09,30902,False,,,algorithm_risk_score,,,jennifer.wright10@mail.com,False,False,Female,False,False,False,1981-03-10,True,False,False,90252,False,,False,False,annual_income,135000.0,False,False,False,False,False,62,False,False,False,0.09,False,False,False,30902.0,False,,,algorithm_risk_score,False,False,False,False,True,False,False,False,False,False,False,True,True,False,False,False,False,False,False,False,False,False,True,False,1,1,True,False,unique,missing_or_unparseable_timestamp_fallback_max_row_id
43,app_169,2024-01-15T00:00:00Z,Brian Brown,brian.brown29@icloud.com,566-85-7180,10.10.233.92,Male,1986-12-06,10014,85000,,45,0.11,61833,True,4.4,28000.0,,,,brian.brown29@icloud.com,False,False,Male,False,False,False,1986-12-06,False,False,False,10014,False,2024-01-15T00:00:00Z,False,False,annual_income,85000.0,False,False,False,False,False,45,False,False,False,0.11,False,False,False,61833.0,True,4.4,28000.0,,False,False,False,False,False,False,False,False,False,False,False,False,False,False,False,False,False,False,False,False,False,False,True,False,1,1,True,False,unique,latest_processing_timestamp
44,app_108,,Timothy Thomas,timothy.thomas35@yahoo.com,829-65-3490,10.226.135.76,Male,14/06/1975,10057,93000,,62,0.42,29257,True,4.2,44000.0,,,,timothy.thomas35@yahoo.com,False,False,Male,False,False,False,1975-06-14,False,False,False,10057,False,,False,False,annual_income,93000.0,False,False,False,False,False,62,False,False,False,0.42,False,False,False,29257.0,True,4.2,44000.0,,False,False,False,False,True,False,False,False,False,False,False,True,False,False,False,False,False,False,False,False,False,False,True,False,1,1,True,False,unique,missing_or_unparseable_timestamp_fallback_max_row_id
45,app_497,,Patrick Wilson,patrick.wilson77@hotmail.com,655-58-3025,10.131.43.18,Male,04/20/1994,90233,48000,,4,0.1,21540,False,,,algorithm_risk_score,,,patrick.wilson77@hotmail.com,False,False,Male,False,False,False,1994-04-20,False,False,False,90233,False,,False,False,annual_income,48000.0,False,False,False,False,False,4,False,False,False,0.1,False,False,False,21540.0,False,,,algorithm_risk_score,False,False,False,False,True,False,False,False,False,False,False,True,False,False,False,False,False,False,False,False,False,False,True,False,1,1,True,False,unique,missing_or_unparseable_timestamp_fallback_max_row_id
46,app_174,2024-01-15T00:00:00Z,Katherine Baker,katherine.baker50@outlook.com,405-23-3195,192.168.75.133,Female,1990-01-15,90237,98000,,31,0.34,34731,True,2.7,33000.0,,,,katherine.baker50@outlook.com,False,False,Female,False,False,False,1990-01-15,False,False,False,90237,False,2024-01-15T00:00:00Z,False,False,annual_income,98000.0,False,False,False,False,False,31,False,False,False,0.34,False,False,False,34731.0,True,2.7,33000.0,,False,False,False,False,False,False,False,False,False,False,False,False,False,False,False,False,False,False,False,False,False,False,True,False,1,1,True,False,unique,latest_processing_timestamp
47,app_010,,Barbara Rodriguez,barbara.rodriguez33@icloud.com,624-58-7406,10.100.68.10,Female,1996-09-07,90250,44000,,62,0.25,6824,False,,,algorithm_risk_score,,,barbara.rodriguez33@icloud.com,False,False,Female,False,False,False,1996-09-07,False,False,False,90250,False,,False,False,annual_income,44000.0,False,False,False,False,False,62,False,False,False,0.25,False,False,False,6824.0,False,,,algorithm_risk_score,False,False,False,False,True,False,False,False,False,False,False,False,False,False,False,False,False,False,False,False,False,False,True,False,1,1,True,False,unique,missing_or_unparseable_timestamp_fallback_max_row_id
48,app_486,,Nicholas Garcia,nicholas.garcia36@gmail.com,109-41-3092,192.168.244.27,Male,1963-09-15,10040,79000,,95,0.09,35264,True,2.9,64000.0,,,,nicholas.garcia36@gmail.com,False,False,Male,False,False,False,1963-09-15,False,False,False,10040,False,,False,False,annual_income,79000.0,False,False,False,False,False,95,False,False,False,0.09,False,False,False,35264.0,True,2.9,64000.0,,False,False,False,False,True,False,False,False,False,False,False,False,False,False,False,False,False,False,False,False,False,False,True,False,1,1,True,False,unique,missing_or_unparseable_timestamp_fallback_max_row_id
49,app_367,,Heather Davis,heather.davis33@icloud.com,618-61-5297,192.168.21.66,Female,04/08/1979,90212,97000,,64,0.33,36196,True,2.7,76000.0,,,,heather.davis33@icloud.com,False,False,Female,False,False,False,1979-04-08,True,False,False,90212,False,,False,False,annual_income,97000.0,False,False,False,False,False,64,False,False,False,0.33,False,False,False,36196.0,True,2.7,76000.0,,False,False,False,False,True,False,False,False,False,False,False,True,True,False,False,False,False,False,False,False,False,False,True,False,1,1,True,False,unique,missing_or_unparseable_timestamp_fallback_max_row_id
50,app_360,,Eric Brown,eric.brown89@hotmail.com,659-91-9371,172.24.47.60,Male,1971-12-16,30007,107000,,104,0.13,31281,True,2.8,53000.0,,,,eric.brown89@hotmail.com,False,False,Male,False,False,False,1971-12-16,False,False,False,30007,False,,False,False,annual_income,107000.0,False,False,False,False,False,104,False,False,False,0.13,False,False,False,31281.0,True,2.8,53000.0,,False,False,False,False,True,False,False,False,False,False,False,False,False,False,False,False,False,False,False,False,False,False,True,False,1,1,True,False,unique,missing_or_unparseable_timestamp_fallback_max_row_id
51,app_115,,Maria Mitchell,maria.mitchell17@yahoo.com,799-16-1536,10.101.190.145,Female,1977-02-09,90294,123000,,52,0.07,82257,True,3.6,23000.0,,,,maria.mitchell17@yahoo.com,False,False,Female,False,False,False,1977-02-09,False,False,False,90294,False,,False,False,annual_income,123000.0,False,False,False,False,False,52,False,False,False,0.07,False,False,False,82257.0,True,3.6,23000.0,,False,False,False,False,True,False,False,False,False,False,False,False,False,False,False,False,False,False,False,False,False,False,True,False,1,1,True,False,unique,missing_or_unparseable_timestamp_fallback_max_row_id
52,app_084,,Pamela Scott,pamela.scott14@icloud.com,478-77-8200,10.162.27.170,Female,1986-03-24,90279,160000,,54,0.4,78286,True,4.0,50000.0,,,,pamela.scott14@icloud.com,False,False,Female,False,False,False,1986-03-24,False,False,False,90279,False,,False,False,annual_income,160000.0,False,False,False,False,False,54,False,False,False,0.4,False,False,False,78286.0,True,4.0,50000.0,,False,False,False,False,True,False,False,False,False,False,False,False,False,False,False,False,False,False,False,False,False,False,True,False,1,1,True,False,unique,missing_or_unparseable_timestamp_fallback_max_row_id
53,app_491,,Mary Harris,mary.harris76@protonmail.com,945-13-9714,10.78.4.251,Female,1974-01-17,10048,79000,,100,0.1,30078,False,,,algorithm_risk_score,,,mary.harris76@protonmail.com,False,False,Female,False,False,False,1974-01-17,False,False,False,10048,False,,False,False,annual_income,79000.0,False,False,False,False,False,100,False,False,False,0.1,False,False,False,30078.0,False,,,algorithm_risk_score,False,False,False,False,True,False,False,False,False,False,False,False,False,False,False,False,False,False,False,False,False,False,True,False,1,1,True,False,unique,missing_or_unparseable_timestamp_fallback_max_row_id
54,app_065,,Amy Sanchez,amy.sanchez67@mail.com,684-77-5305,10.60.248.190,F,1992-10-08,10070,109000,,41,0.37,30645,False,,,algorithm_risk_score,,,amy.sanchez67@mail.com,False,False,Female,False,False,True,1992-10-08,False,False,False,10070,False,,False,False,annual_income,109000.0,False,False,False,False,False,41,False,False,False,0.37,False,False,False,30645.0,False,,,algorithm_risk_score,False,False,False,False,True,False,False,False,False,True,False,False,False,False,False,False,False,False,False,False,False,False,True,False,1,1,True,False,unique,missing_or_unparseable_timestamp_fallback_max_row_id
55,app_148,2024-01-15T00:00:00Z,Shirley Davis,shirley.davis62@icloud.com,384-17-7019,10.121.226.226,Female,1982-08-11,90261,122000,,72,0.37,35207,True,3.3,25000.0,,,,shirley.davis62@icloud.com,False,False,Female,False,False,False,1982-08-11,False,False,False,90261,False,2024-01-15T00:00:00Z,False,False,annual_income,122000.0,False,False,False,False,False,72,False,False,False,0.37,False,False,False,35207.0,True,3.3,25000.0,,False,False,False,False,False,False,False,False,False,False,False,False,False,False,False,False,False,False,False,False,False,False,True,False,1,1,True,False,unique,latest_processing_timestamp
56,app_028,,Brenda Robinson,brenda.robinson48@mail.com,636-75-6279,172.21.129.236,Female,1985-09-06,10003,90000,,60,0.2,38832,False,,,algorithm_risk_score,,,brenda.robinson48@mail.com,False,False,Female,False,False,False,1985-09-06,False,False,False,10003,False,,False,False,annual_income,90000.0,False,False,False,False,False,60,False,False,False,0.2,False,False,False,38832.0,False,,,algorithm_risk_score,False,False,False,False,True,False,False,False,False,False,False,False,False,False,False,False,False,False,False,False,False,False,True,False,1,1,True,False,unique,missing_or_unparseable_timestamp_fallback_max_row_id
57,app_272,,Rebecca Rivera,rebecca.rivera38@outlook.com,160-39-1506,10.75.157.206,Female,1982-03-02,90227,79000,,70,0.41,34365,False,,,algorithm_risk_score,,,rebecca.rivera38@outlook.com,False,False,Female,False,False,False,1982-03-02,False,False,False,90227,False,,False,False,annual_income,79000.0,False,False,False,False,False,70,False,False,False,0.41,False,False,False,34365.0,False,,,algorithm_risk_score,False,False,False,False,True,False,False,False,False,False,False,False,False,False,False,False,False,False,False,False,False,False,True,False,1,1,True,False,unique,missing_or_unparseable_timestamp_fallback_max_row_id
58,app_263,,Jeffrey Green,jeffrey.green8@hotmail.com,183-73-3729,172.26.114.52,Male,1983-12-16,10055,153000,,64,0.07,39627,True,5.0,68000.0,,,,jeffrey.green8@hotmail.com,False,False,Male,False,False,False,1983-12-16,False,False,False,10055,False,,False,False,annual_income,153000.0,False,False,False,False,False,64,False,False,False,0.07,False,False,False,39627.0,True,5.0,68000.0,,False,False,False,False,True,False,False,False,False,False,False,False,False,False,False,False,False,False,False,False,False,False,True,False,1,1,True,False,unique,missing_or_unparseable_timestamp_fallback_max_row_id
59,app_160,2024-01-15T00:00:00Z,George Thompson,george.thompson36@aol.com,904-48-6710,192.168.48.92,Male,29/12/1982,10056,80000,,18,0.18,58748,True,2.8,31000.0,,,,george.thompson36@aol.com,False,False,Male,False,False,False,1982-12-29,False,False,False,10056,False,2024-01-15T00:00:00Z,False,False,annual_income,80000.0,False,False,False,False,False,18,False,False,False,0.18,False,False,False,58748.0,True,2.8,31000.0,,False,False,False,False,False,False,False,False,False,False,False,True,False,False,False,False,False,False,False,False,False,False,True,False,1,1,True,False,unique,latest_processing_timestamp
60,app_228,,Emily Walker,emily.walker42@outlook.com,175-63-6572,192.168.253.184,Female,14/12/1987,90280,70000,,58,0.42,25883,True,3.5,35000.0,,vacation,,emily.walker42@outlook.com,False,False,Female,False,False,False,1987-12-14,False,False,False,90280,False,,False,False,annual_income,70000.0,False,False,False,False,False,58,False,False,False,0.42,False,False,False,25883.0,True,3.5,35000.0,,False,False,False,False,True,False,False,False,False,False,False,True,False,False,False,False,False,False,False,False,False,False,True,False,1,1,True,False,unique,missing_or_unparseable_timestamp_fallback_max_row_id
61,app_076,,Sarah Taylor,sarah.taylor74@icloud.com,773-71-1401,172.27.159.52,Female,1990-12-28,90285,66000,,35,0.43,13607,False,,,insufficient_credit_history,,,sarah.taylor74@icloud.com,False,False,Female,False,False,False,1990-12-28,False,False,False,90285,False,,False,False,annual_income,66000.0,False,False,False,False,False,35,False,False,False,0.43,False,False,False,13607.0,False,,,insufficient_credit_history,False,False,False,False,True,False,False,False,False,False,False,False,False,False,False,False,False,False,False,False,False,False,True,False,1,1,True,False,unique,missing_or_unparseable_timestamp_fallback_max_row_id
62,app_410,,Edward Mitchell,edward.mitchell78@hotmail.com,330-61-3858,192.168.30.200,Male,1995-06-21,10051,66000,,6,0.24,30498,True,4.9,41000.0,,,,edward.mitchell78@hotmail.com,False,False,Male,False,False,False,1995-06-21,False,False,False,10051,False,,False,False,annual_income,66000.0,False,False,False,False,False,6,False,False,False,0.24,False,False,False,30498.0,True,4.9,41000.0,,False,False,False,False,True,False,False,False,False,False,False,False,False,False,False,False,False,False,False,False,False,False,True,False,1,1,True,False,unique,missing_or_unparseable_timestamp_fallback_max_row_id
63,app_208,,James Martin,james.martin69@hotmail.com,155-19-6776,172.17.130.224,Male,1966-10-28,10061,97000,,92,0.34,21594,True,2.8,26000.0,,education,,james.martin69@hotmail.com,False,False,Male,False,False,False,1966-10-28,False,False,False,10061,False,,False,False,annual_income,97000.0,False,False,False,False,False,92,False,False,False,0.34,False,False,False,21594.0,True,2.8,26000.0,,False,False,False,False,True,False,False,False,False,False,False,False,False,False,False,False,False,False,False,False,False,False,True,False,1,1,True,False,unique,missing_or_unparseable_timestamp_fallback_max_row_id
64,app_279,,Joseph Scott,joseph.scott2@yahoo.com,448-37-9481,172.18.113.220,M,1982-12-11,30012,75000,,76,0.39,4974,True,5.4,15000.0,,,,joseph.scott2@yahoo.com,False,False,Male,False,False,True,1982-12-11,False,False,False,30012,False,,False,False,annual_income,75000.0,False,False,False,False,False,76,False,False,False,0.39,False,False,False,4974.0,True,5.4,15000.0,,False,False,False,False,True,False,False,False,False,True,False,False,False,False,False,False,False,False,False,False,False,False,True,False,1,1,True,False,unique,missing_or_unparseable_timestamp_fallback_max_row_id
65,app_241,,Helen Anderson,helen.anderson61@mail.com,852-81-4532,192.168.33.162,Female,1964-07-10,90230,96000,,103,0.44,31709,True,5.8,18000.0,,personal,,helen.anderson61@mail.com,False,False,Female,False,False,False,1964-07-10,False,False,False,90230,False,,False,False,annual_income,96000.0,False,False,False,False,False,103,False,False,False,0.44,False,False,False,31709.0,True,5.8,18000.0,,False,False,False,False,True,False,False,False,False,False,False,False,False,False,False,False,False,False,False,False,False,False,True,False,1,1,True,False,unique,missing_or_unparseable_timestamp_fallback_max_row_id
66,app_054,,Jack Martin,jack.martin17@protonmail.com,944-51-9855,192.168.146.66,Male,1995-12-10,10043,86000,,16,0.26,28260,True,6.3,61000.0,,,,jack.martin17@protonmail.com,False,False,Male,False,False,False,1995-12-10,False,False,False,10043,False,,False,False,annual_income,86000.0,False,False,False,False,False,16,False,False,False,0.26,False,False,False,28260.0,True,6.3,61000.0,,False,False,False,False,True,False,False,False,False,False,False,False,False,False,False,False,False,False,False,False,False,False,True,False,1,1,True,False,unique,missing_or_unparseable_timestamp_fallback_max_row_id
67,app_195,2024-01-15T00:00:00Z,Mark Campbell,mark.campbell36@aol.com,730-25-4224,192.168.3.184,Male,1992-03-26,10005,61000,,0,0.29,19373,True,5.1,77000.0,,,,mark.campbell36@aol.com,False,False,Male,False,False,False,1992-03-26,False,False,False,10005,False,2024-01-15T00:00:00Z,False,False,annual_income,61000.0,False,False,False,False,False,0,False,False,False,0.29,False,False,False,19373.0,True,5.1,77000.0,,False,False,True,True,False,False,False,False,False,False,False,False,False,False,False,False,False,False,False,False,True,True,True,False,1,1,True,False,unique,latest_processing_timestamp
68,app_015,,Michael Lopez,michael.lopez67@yahoo.com,752-48-9134,192.168.244.94,Male,1985-11-09,10061,118000,,96,0.4,76692,False,,,algorithm_risk_score,,,michael.lopez67@yahoo.com,False,False,Male,False,False,False,1985-11-09,False,False,False,10061,False,,False,False,annual_income,118000.0,False,False,False,False,False,96,False,False,False,0.4,False,False,False,76692.0,False,,,algorithm_risk_score,False,False,False,False,True,False,False,False,False,False,False,False,False,False,False,False,False,False,False,False,False,False,True,False,1,1,True,False,unique,missing_or_unparseable_timestamp_fallback_max_row_id
69,app_039,,Robert Anderson,robert.anderson1@hotmail.com,892-10-2689,192.168.126.225,Male,30/09/1978,90249,137000,,73,0.29,62951,False,,,algorithm_risk_score,,,robert.anderson1@hotmail.com,False,False,Male,False,False,False,1978-09-30,False,False,False,90249,False,,False,False,annual_income,137000.0,False,False,False,False,False,73,False,False,False,0.29,False,False,False,62951.0,False,,,algorithm_risk_score,False,False,False,False,True,False,False,False,False,False,False,True,False,False,False,False,False,False,False,False,False,False,True,False,1,1,True,False,unique,missing_or_unparseable_timestamp_fallback_max_row_id
70,app_492,,Cynthia Garcia,cynthia.garcia42@mail.com,809-99-1251,172.25.153.215,Female,1994/03/03,90225,46000,,0,0.09,9578,False,,,algorithm_risk_score,,,cynthia.garcia42@mail.com,False,False,Female,False,False,False,1994-03-03,False,False,False,90225,False,,False,False,annual_income,46000.0,False,False,False,False,False,0,False,False,False,0.09,False,False,False,9578.0,False,,,algorithm_risk_score,False,False,False,False,True,False,False,False,False,False,False,True,False,False,False,False,False,False,False,False,False,False,True,False,1,1,True,False,unique,missing_or_unparseable_timestamp_fallback_max_row_id
71,app_093,,Margaret Allen,margaret.allen89@yahoo.com,343-37-9988,172.20.198.144,F,1983-01-01,90230,137000,,36,0.08,16139,True,6.1,59000.0,,,,margaret.allen89@yahoo.com,False,False,Female,False,False,True,1983-01-01,False,False,False,90230,False,,False,False,annual_income,137000.0,False,False,False,False,False,36,False,False,False,0.08,False,False,False,16139.0,True,6.1,59000.0,,False,False,False,False,True,False,False,False,False,True,False,False,False,False,False,False,False,False,False,False,False,False,True,False,1,1,True,False,unique,missing_or_unparseable_timestamp_fallback_max_row_id
72,app_356,,Gary Davis,gary.davis57@gmail.com,291-94-4709,10.171.154.188,Male,1987-01-17,10058,69000,,67,0.4,28596,True,5.9,37000.0,,,,gary.davis57@gmail.com,False,False,Male,False,False,False,1987-01-17,False,False,False,10058,False,,False,False,annual_income,69000.0,False,False,False,False,False,67,False,False,False,0.4,False,False,False,28596.0,True,5.9,37000.0,,False,False,False,False,True,False,False,False,False,False,False,False,False,False,False,False,False,False,False,False,False,False,True,False,1,1,True,False,unique,missing_or_unparseable_timestamp_fallback_max_row_id
73,app_164,2024-01-15T00:00:00Z,Brian Brown,brian.brown61@yahoo.com,586-29-4288,192.168.240.12,Male,1978-10-04,10004,101000,,117,0.14,34221,True,4.1,62000.0,,,,brian.brown61@yahoo.com,False,False,Male,False,False,False,1978-10-04,False,False,False,10004,False,2024-01-15T00:00:00Z,False,False,annual_income,101000.0,False,False,False,False,False,117,False,False,False,0.14,False,False,False,34221.0,True,4.1,62000.0,,False,False,False,False,False,False,False,False,False,False,False,False,False,False,False,False,False,False,False,False,False,False,True,False,1,1,True,False,unique,latest_processing_timestamp
74,app_372,,Kathleen Mitchell,kathleen.mitchell10@outlook.com,381-49-1110,192.168.116.86,Female,11/03/1967,90229,77000,,115,0.22,22843,False,,,algorithm_risk_score,,,kathleen.mitchell10@outlook.com,False,False,Female,False,False,False,1967-11-03,True,False,False,90229,False,,False,False,annual_income,77000.0,False,False,False,False,False,115,False,False,False,0.22,False,False,False,22843.0,False,,,algorithm_risk_score,False,False,False,False,True,False,False,False,False,False,False,True,True,False,False,False,False,False,False,False,False,False,True,False,1,1,True,False,unique,missing_or_unparseable_timestamp_fallback_max_row_id
75,app_460,,Helen Ramirez,helen.ramirez17@yahoo.com,993-57-7662,10.10.20.83,Female,1988-05-31,90266,85000,,19,0.41,28777,False,,,insufficient_credit_history,,,helen.ramirez17@yahoo.com,False,False,Female,False,False,False,1988-05-31,False,False,False,90266,False,,False,False,annual_income,85000.0,False,False,False,False,False,19,False,False,False,0.41,False,False,False,28777.0,False,,,insufficient_credit_history,False,False,False,False,True,False,False,False,False,False,False,False,False,False,False,False,False,False,False,False,False,False,True,False,1,1,True,False,unique,missing_or_unparseable_timestamp_fallback_max_row_id
76,app_436,,Amanda Torres,amanda.torres59@gmail.com,135-51-1195,172.18.137.22,F,1998-06-02,90217,,45000.0,35,0.13,10311,True,3.9,63000.0,,,,amanda.torres59@gmail.com,False,False,Female,False,False,True,1998-06-02,False,False,False,90217,False,,False,True,annual_salary,45000.0,False,False,False,False,False,35,False,False,False,0.13,False,False,False,10311.0,True,3.9,63000.0,,False,False,False,False,True,False,False,False,False,True,False,False,False,False,True,False,False,False,False,False,False,False,True,False,1,1,True,False,unique,missing_or_unparseable_timestamp_fallback_max_row_id
77,app_392,,Emma Johnson,emma.johnson73@yahoo.com,518-98-9708,192.168.52.95,Female,28/11/1998,90217,56000,,0,0.16,25551,True,4.5,39000.0,,,,emma.johnson73@yahoo.com,False,False,Female,False,False,False,1998-11-28,False,False,False,90217,False,,False,False,annual_income,56000.0,False,False,False,False,False,0,False,False,False,0.16,False,False,False,25551.0,True,4.5,39000.0,,False,False,True,True,True,False,False,False,False,False,False,True,False,False,False,False,False,False,False,False,True,True,True,False,1,1,True,False,unique,missing_or_unparseable_timestamp_fallback_max_row_id
78,app_264,,Stephen Wright,stephen.wright37@yahoo.com,988-31-5993,172.20.59.38,Male,1996/04/07,10063,50000,,19,0.23,17902,True,4.3,39000.0,,,,stephen.wright37@yahoo.com,False,False,Male,False,False,False,1996-04-07,False,False,False,10063,False,,False,False,annual_income,50000.0,False,False,False,False,False,19,False,False,False,0.23,False,False,False,17902.0,True,4.3,39000.0,,False,False,False,False,True,False,False,False,False,False,False,True,False,False,False,False,False,False,False,False,False,False,True,False,1,1,True,False,unique,missing_or_unparseable_timestamp_fallback_max_row_id
79,app_032,,Andrew Martinez,andrew.martinez39@outlook.com,788-38-3158,172.26.119.18,Male,1982-09-29,30019,124000,,72,0.07,24282,True,5.5,75000.0,,,,andrew.martinez39@outlook.com,False,False,Male,False,False,False,1982-09-29,False,False,False,30019,False,,False,False,annual_income,124000.0,False,False,False,False,False,72,False,False,False,0.07,False,False,False,24282.0,True,5.5,75000.0,,False,False,False,False,True,False,False,False,False,False,False,False,False,False,False,False,False,False,False,False,False,False,True,False,1,1,True,False,unique,missing_or_unparseable_timestamp_fallback_max_row_id
80,app_483,,Michael Sanchez,michael.sanchez85@aol.com,871-12-1159,192.168.5.114,M,1975-09-11,10047,99000,,44,0.07,27423,True,6.5,80000.0,,,,michael.sanchez85@aol.com,False,False,Male,False,False,True,1975-09-11,False,False,False,10047,False,,False,False,annual_income,99000.0,False,False,False,False,False,44,False,False,False,0.07,False,False,False,27423.0,True,6.5,80000.0,,False,False,False,False,True,False,False,False,False,True,False,False,False,False,False,False,False,False,False,False,False,False,True,False,1,1,True,False,unique,missing_or_unparseable_timestamp_fallback_max_row_id
81,app_008,,Karen Martin,karen.martin3@outlook.com,351-97-8739,10.234.196.212,Female,1993-07-12,90244,80000,,24,0.43,22882,True,3.6,51000.0,,,,karen.martin3@outlook.com,False,False,Female,False,False,False,1993-07-12,False,False,False,90244,False,,False,False,annual_income,80000.0,False,False,False,False,False,24,False,False,False,0.43,False,False,False,22882.0,True,3.6,51000.0,,False,False,False,False,True,False,False,False,False,False,False,False,False,False,False,False,False,False,False,False,False,False,True,False,1,1,True,False,unique,missing_or_unparseable_timestamp_fallback_max_row_id
82,app_419,,Timothy Hernandez,timothy.hernandez1@outlook.com,937-93-2440,172.30.247.166,Male,1987-09-18,10096,125000,,5,0.24,63180,False,,,algorithm_risk_score,,,timothy.hernandez1@outlook.com,False,False,Male,False,False,False,1987-09-18,False,False,False,10096,False,,False,False,annual_income,125000.0,False,False,False,False,False,5,False,False,False,0.24,False,False,False,63180.0,False,,,algorithm_risk_score,False,False,False,False,True,False,False,False,False,False,False,False,False,False,False,False,False,False,False,False,False,False,True,False,1,1,True,False,unique,missing_or_unparseable_timestamp_fallback_max_row_id
83,app_442,,Amanda Wright,amanda.wright91@mail.com,735-49-5306,192.168.34.15,Female,1972-12-18,90232,58000,,88,0.11,13402,False,,,algorithm_risk_score,,,amanda.wright91@mail.com,False,False,Female,False,False,False,1972-12-18,False,False,False,90232,False,,False,False,annual_income,58000.0,False,False,False,False,False,88,False,False,False,0.11,False,False,False,13402.0,False,,,algorithm_risk_score,False,False,False,False,True,False,False,False,False,False,False,False,False,False,False,False,False,False,False,False,False,False,True,False,1,1,True,False,unique,missing_or_unparseable_timestamp_fallback_max_row_id
84,app_493,,Katherine Jones,katherine.jones30@hotmail.com,815-55-6710,172.28.130.54,Female,1973-01-23,90245,100000,,99,0.25,34716,True,4.1,24000.0,,,,katherine.jones30@hotmail.com,False,False,Female,False,False,False,1973-01-23,False,False,False,90245,False,,False,False,annual_income,100000.0,False,False,False,False,False,99,False,False,False,0.25,False,False,False,34716.0,True,4.1,24000.0,,False,False,False,False,True,False,False,False,False,False,False,False,False,False,False,False,False,False,False,False,False,False,True,False,1,1,True,False,unique,missing_or_unparseable_timestamp_fallback_max_row_id
85,app_416,,Samuel Davis,samuel.davis97@mail.com,119-56-1715,10.203.158.136,Male,1981-10-11,10066,100000,,59,0.2,46148,False,,,algorithm_risk_score,,,samuel.davis97@mail.com,False,False,Male,False,False,False,1981-10-11,False,False,False,10066,False,,False,False,annual_income,100000.0,False,False,False,False,False,59,False,False,False,0.2,False,False,False,46148.0,False,,,algorithm_risk_score,False,False,False,False,True,False,False,False,False,False,False,False,False,False,False,False,False,False,False,False,False,False,True,False,1,1,True,False,unique,missing_or_unparseable_timestamp_fallback_max_row_id
86,app_119,,Amy Hernandez,amy.hernandez98@protonmail.com,595-13-3321,172.30.159.145,Female,1991-12-21,90216,74000,,0,0.45,24617,False,,,algorithm_risk_score,,,amy.hernandez98@protonmail.com,False,False,Female,False,False,False,1991-12-21,False,False,False,90216,False,,False,False,annual_income,74000.0,False,False,False,False,False,0,False,False,False,0.45,False,False,False,24617.0,False,,,algorithm_risk_score,False,False,False,False,True,False,False,False,False,False,False,False,False,False,False,False,False,False,False,False,False,False,True,False,1,1,True,False,unique,missing_or_unparseable_timestamp_fallback_max_row_id
87,app_240,,Maria Wright,maria.wright71@protonmail.com,391-67-6469,192.168.197.60,Female,1974-11-27,90209,130000,,83,0.14,59062,False,,,algorithm_risk_score,home_improvement,,maria.wright71@protonmail.com,False,False,Female,False,False,False,1974-11-27,False,False,False,90209,False,,False,False,annual_income,130000.0,False,False,False,False,False,83,False,False,False,0.14,False,False,False,59062.0,False,,,algorithm_risk_score,False,False,False,False,True,False,False,False,False,False,False,False,False,False,False,False,False,False,False,False,False,False,True,False,1,1,True,False,unique,missing_or_unparseable_timestamp_fallback_max_row_id
88,app_154,2024-01-15T00:00:00Z,Michelle Perez,michelle.perez39@protonmail.com,372-23-4447,192.168.101.97,Female,12/16/1985,30015,119000,,65,0.09,86849,True,6.5,15000.0,,,,michelle.perez39@protonmail.com,False,False,Female,False,False,False,1985-12-16,False,False,False,30015,False,2024-01-15T00:00:00Z,False,False,annual_income,119000.0,False,False,False,False,False,65,False,False,False,0.09,False,False,False,86849.0,True,6.5,15000.0,,False,False,False,False,False,False,False,False,False,False,False,True,False,False,False,False,False,False,False,False,False,False,True,False,1,1,True,False,unique,latest_processing_timestamp
89,app_166,2024-01-15T00:00:00Z,Amy Harris,amy.harris92@mail.com,262-99-5707,192.168.208.6,Female,1978-08-03,90247,118000,,54,0.13,35023,False,,,algorithm_risk_score,,,amy.harris92@mail.com,False,False,Female,False,False,False,1978-08-03,False,False,False,90247,False,2024-01-15T00:00:00Z,False,False,annual_income,118000.0,False,False,False,False,False,54,False,False,False,0.13,False,False,False,35023.0,False,,,algorithm_risk_score,False,False,False,False,False,False,False,False,False,False,False,False,False,False,False,False,False,False,False,False,False,False,True,False,1,1,True,False,unique,latest_processing_timestamp
90,app_100,,George Campbell,george.campbell53@outlook.com,438-48-3242,172.29.10.254,M,1962-05-01,10001,79000,,99,0.22,36346,True,2.8,19000.0,,,,george.campbell53@outlook.com,False,False,Male,False,False,True,1962-05-01,False,False,False,10001,False,,False,False,annual_income,79000.0,False,False,False,False,False,99,False,False,False,0.22,False,False,False,36346.0,True,2.8,19000.0,,False,False,False,False,True,False,False,False,False,True,False,False,False,False,False,False,False,False,False,False,False,False,True,False,1,1,True,False,unique,missing_or_unparseable_timestamp_fallback_max_row_id
91,app_107,,George Garcia,george.garcia38@outlook.com,565-34-4484,172.30.66.2,M,1960-01-12,10087,91000,,105,0.3,37143,False,,,algorithm_risk_score,,,george.garcia38@outlook.com,False,False,Male,False,False,True,1960-01-12,False,False,False,10087,False,,False,False,annual_income,91000.0,False,False,False,False,False,105,False,False,False,0.3,False,False,False,37143.0,False,,,algorithm_risk_score,False,False,False,False,True,False,False,False,False,True,False,False,False,False,False,False,False,False,False,False,False,False,True,False,1,1,True,False,unique,missing_or_unparseable_timestamp_fallback_max_row_id
92,app_088,,Susan Martinez,susan.martinez83@protonmail.com,780-24-9300,172.23.224.13,F,1986-10-15,90229,55000,,55,0.43,29118,False,,,algorithm_risk_score,,,susan.martinez83@protonmail.com,False,False,Female,False,False,True,1986-10-15,False,False,False,90229,False,,False,False,annual_income,55000.0,False,False,False,False,False,55,False,False,False,0.43,False,False,False,29118.0,False,,,algorithm_risk_score,False,False,False,False,True,False,False,False,False,True,False,False,False,True,False,False,False,False,False,False,False,False,True,False,1,1,True,False,unique,missing_or_unparseable_timestamp_fallback_max_row_id
93,app_114,,Shirley Thompson,shirley.thompson14@hotmail.com,841-69-3137,172.20.125.54,Female,1991/03/01,90204,75000,,52,0.12,23554,True,3.9,50000.0,,,,shirley.thompson14@hotmail.com,False,False,Female,False,False,False,1991-03-01,False,False,False,90204,False,,False,False,annual_income,75000.0,False,False,False,False,False,52,False,False,False,0.12,False,False,False,23554.0,True,3.9,50000.0,,False,False,False,False,True,False,False,False,False,False,False,True,False,False,False,False,False,False,False,False,False,False,True,False,1,1,True,False,unique,missing_or_unparseable_timestamp_fallback_max_row_id
94,app_421,,Donald Baker,donald.baker60@icloud.com,344-50-4287,192.168.147.249,Male,1982-07-17,10027,,46000.0,44,0.06,5018,True,6.0,45000.0,,,,donald.baker60@icloud.com,False,False,Male,False,False,False,1982-07-17,False,False,False,10027,False,,False,True,annual_salary,46000.0,False,False,False,False,False,44,False,False,False,0.06,False,False,False,5018.0,True,6.0,45000.0,,False,False,False,False,True,False,False,False,False,False,False,False,False,False,True,False,False,False,False,False,False,False,True,False,1,1,True,False,unique,missing_or_unparseable_timestamp_fallback_max_row_id
95,app_323,,Michael Thompson,michael.thompson45@gmail.com,862-33-2796,172.26.169.208,Male,08/11/1981,10090,113000,,92,0.4,27746,True,3.9,80000.0,,,,michael.thompson45@gmail.com,False,False,Male,False,False,False,1981-08-11,True,False,False,10090,False,,False,False,annual_income,113000.0,False,False,False,False,False,92,False,False,False,0.4,False,False,False,27746.0,True,3.9,80000.0,,False,False,False,False,True,False,False,False,False,False,False,True,True,False,False,False,False,False,False,False,False,False,True,False,1,1,True,False,unique,missing_or_unparseable_timestamp_fallback_max_row_id
96,app_288,,Susan Young,susan.young22@mail.com,159-19-1765,192.168.114.250,Female,1962-11-05,90252,88000,,71,0.27,23054,True,5.5,67000.0,,,,susan.young22@mail.com,False,False,Female,False,False,False,1962-11-05,False,False,False,90252,False,,False,False,annual_income,88000.0,False,False,False,False,False,71,False,False,False,0.27,False,False,False,23054.0,True,5.5,67000.0,,False,False,False,False,True,False,False,False,False,False,False,False,False,False,False,False,False,False,False,False,False,False,True,False,1,1,True,False,unique,missing_or_unparseable_timestamp_fallback_max_row_id
97,app_396,,Katherine Harris,katherine.harris16@outlook.com,174-24-9597,10.14.75.95,Female,1976-01-28,10027,96000,,124,0.2,33232,True,5.4,40000.0,,,,katherine.harris16@outlook.com,False,False,Female,False,False,False,1976-01-28,False,False,False,10027,False,,False,False,annual_income,96000.0,False,False,False,False,False,124,False,False,False,0.2,False,False,False,33232.0,True,5.4,40000.0,,False,False,False,False,True,False,False,False,False,False,False,False,False,False,False,False,False,False,False,False,False,False,True,False,1,1,True,False,unique,missing_or_unparseable_timestamp_fallback_max_row_id
98,app_371,,Sarah Walker,sarah.walker95@mail.com,142-97-2132,10.57.113.229,Female,1995-02-23,90250,76000,,12,0.11,59032,False,,,algorithm_risk_score,,,sarah.walker95@mail.com,False,False,Female,False,False,False,1995-02-23,False,False,False,90250,False,,False,False,annual_income,76000.0,False,False,False,False,False,12,False,False,False,0.11,False,False,False,59032.0,False,,,algorithm_risk_score,False,False,False,False,True,False,False,False,False,False,False,False,False,False,False,False,False,False,False,False,False,False,True,False,1,1,True,False,unique,missing_or_unparseable_timestamp_fallback_max_row_id
99,app_479,,Sandra Jones,sandra.jones59@outlook.com,424-34-1670,172.25.239.70,F,1983/11/08,90205,,94000.0,56,0.11,15630,False,,,algorithm_risk_score,,,sandra.jones59@outlook.com,False,False,Female,False,False,True,1983-11-08,False,False,False,90205,False,,False,True,annual_salary,94000.0,False,False,False,False,False,56,False,False,False,0.11,False,False,False,15630.0,False,,,algorithm_risk_score,False,False,False,False,True,False,False,False,False,True,False,True,False,False,True,False,False,False,False,False,False,False,True,False,1,1,True,False,unique,missing_or_unparseable_timestamp_fallback_max_row_id
100,app_149,2024-01-15T00:00:00Z,Linda Nguyen,linda.nguyen56@protonmail.com,183-95-4538,10.251.107.38,Female,1978-11-10,90224,132000,,72,0.2,48329,True,5.1,29000.0,,,,linda.nguyen56@protonmail.com,False,False,Female,False,False,False,1978-11-10,False,False,False,90224,False,2024-01-15T00:00:00Z,False,False,annual_income,132000.0,False,False,False,False,False,72,False,False,False,0.2,False,False,False,48329.0,True,5.1,29000.0,,False,False,False,False,False,False,False,False,False,False,False,False,False,False,False,False,False,False,False,False,False,False,True,False,1,1,True,False,unique,latest_processing_timestamp
101,app_260,,Thomas Hill,thomas.hill26@aol.com,855-44-3925,10.149.26.211,M,09/10/1967,10035,36000,,66,0.2,1358,False,,,algorithm_risk_score,,,thomas.hill26@aol.com,False,False,Male,False,False,True,1967-09-10,True,False,False,10035,False,,False,False,annual_income,36000.0,False,False,False,False,False,66,False,False,False,0.2,False,False,False,1358.0,False,,,algorithm_risk_score,False,False,False,False,True,False,False,False,False,True,False,True,True,False,False,False,False,False,False,False,False,False,True,False,1,1,True,False,unique,missing_or_unparseable_timestamp_fallback_max_row_id
102,app_079,,Elizabeth Hernandez,elizabeth.hernandez71@yahoo.com,112-96-1187,192.168.93.154,Female,1972-12-28,90280,97000,,102,0.31,32958,False,,,high_dti_ratio,,,elizabeth.hernandez71@yahoo.com,False,False,Female,False,False,False,1972-12-28,False,False,False,90280,False,,False,False,annual_income,97000.0,False,False,False,False,False,102,False,False,False,0.31,False,False,False,32958.0,False,,,high_dti_ratio,False,False,False,False,True,False,False,False,False,False,False,False,False,False,False,False,False,False,False,False,False,False,True,False,1,1,True,False,unique,missing_or_unparseable_timestamp_fallback_max_row_id
103,app_251,,Daniel Nelson,daniel.nelson71@protonmail.com,418-57-7031,192.168.70.66,Male,1984-12-25,10096,98000,,19,0.31,27789,False,,,algorithm_risk_score,,,daniel.nelson71@protonmail.com,False,False,Male,False,False,False,1984-12-25,False,False,False,10096,False,,False,False,annual_income,98000.0,False,False,False,False,False,19,False,False,False,0.31,False,False,False,27789.0,False,,,algorithm_risk_score,False,False,False,False,True,False,False,False,False,False,False,False,False,False,False,False,False,False,False,False,False,False,True,False,1,1,True,False,unique,missing_or_unparseable_timestamp_fallback_max_row_id
104,app_404,,Thomas Mitchell,thomas.mitchell21@aol.com,543-21-6993,172.30.59.137,Male,1985-11-10,10017,91000,,31,0.32,2729,True,5.9,69000.0,,,,thomas.mitchell21@aol.com,False,False,Male,False,False,False,1985-11-10,False,False,False,10017,False,,False,False,annual_income,91000.0,False,False,False,False,False,31,False,False,False,0.32,False,False,False,2729.0,True,5.9,69000.0,,False,False,False,False,True,False,False,False,False,False,False,False,False,False,False,False,False,False,False,False,False,False,True,False,1,1,True,False,unique,missing_or_unparseable_timestamp_fallback_max_row_id
105,app_247,,Dorothy Torres,dorothy.torres17@aol.com,850-95-2871,192.168.138.165,Female,1999/06/16,90231,64000,,0,0.21,22335,False,,,algorithm_risk_score,wedding,,dorothy.torres17@aol.com,False,False,Female,False,False,False,1999-06-16,False,False,False,90231,False,,False,False,annual_income,64000.0,False,False,False,False,False,0,False,False,False,0.21,False,False,False,22335.0,False,,,algorithm_risk_score,False,False,False,False,True,False,False,False,False,False,False,True,False,False,False,False,False,False,False,False,False,False,True,False,1,1,True,False,unique,missing_or_unparseable_timestamp_fallback_max_row_id
106,app_162,2024-01-15T00:00:00Z,Eric Rodriguez,eric.rodriguez1@hotmail.com,122-21-5695,10.53.239.200,Male,1991-12-11,10066,55000,,47,0.3,10407,True,2.7,71000.0,,,,eric.rodriguez1@hotmail.com,False,False,Male,False,False,False,1991-12-11,False,False,False,10066,False,2024-01-15T00:00:00Z,False,False,annual_income,55000.0,False,False,False,False,False,47,False,False,False,0.3,False,False,False,10407.0,True,2.7,71000.0,,False,False,False,False,False,False,False,False,False,False,False,False,False,False,False,False,False,False,False,False,False,False,True,False,1,1,True,False,unique,latest_processing_timestamp
107,app_029,,Rebecca Jackson,rebecca.jackson30@icloud.com,756-86-3510,172.31.169.14,F,2001-03-23,10035,46000,,37,0.45,23075,True,3.1,48000.0,,,,rebecca.jackson30@icloud.com,False,False,Female,False,False,True,2001-03-23,False,False,False,10035,False,,False,False,annual_income,46000.0,False,False,False,False,False,37,False,False,False,0.45,False,False,False,23075.0,True,3.1,48000.0,,False,False,False,False,True,False,False,False,False,True,False,False,False,False,False,False,False,False,False,False,False,False,True,False,1,1,True,False,unique,missing_or_unparseable_timestamp_fallback_max_row_id
108,app_345,,Justin White,justin.white92@yahoo.com,845-23-1957,192.168.91.204,Male,1978-08-20,10041,60000,,42,0.34,25288,False,,,algorithm_risk_score,,,justin.white92@yahoo.com,False,False,Male,False,False,False,1978-08-20,False,False,False,10041,False,,False,False,annual_income,60000.0,False,False,False,False,False,42,False,False,False,0.34,False,False,False,25288.0,False,,,algorithm_risk_score,False,False,False,False,True,False,False,False,False,False,False,False,False,False,False,False,False,False,False,False,False,False,True,False,1,1,True,False,unique,missing_or_unparseable_timestamp_fallback_max_row_id
109,app_059,,Jack Lewis,jack.lewis27@hotmail.com,134-13-3673,10.132.239.142,Male,1992/11/21,10029,103000,,50,0.3,40581,False,,,algorithm_risk_score,,,jack.lewis27@hotmail.com,False,False,Male,False,False,False,1992-11-21,False,False,False,10029,False,,False,False,annual_income,103000.0,False,False,False,False,False,50,False,False,False,0.3,False,False,False,40581.0,False,,,algorithm_risk_score,False,False,False,False,True,False,False,False,False,False,False,True,False,False,False,False,False,False,False,False,False,False,True,False,1,1,True,False,unique,missing_or_unparseable_timestamp_fallback_max_row_id
110,app_484,,Samuel Green,samuel.green79@gmail.com,497-67-8063,10.113.219.15,Male,1990-08-10,10001,69000,,27,0.27,10775,True,3.2,34000.0,,,,samuel.green79@gmail.com,False,False,Male,False,False,False,1990-08-10,False,False,False,10001,False,,False,False,annual_income,69000.0,False,False,False,False,False,27,False,False,False,0.27,False,False,False,10775.0,True,3.2,34000.0,,False,False,False,False,True,False,False,False,False,False,False,False,False,False,False,False,False,False,False,False,False,False,True,False,1,1,True,False,unique,missing_or_unparseable_timestamp_fallback_max_row_id
111,app_346,,Gary Martinez,gary.martinez58@protonmail.com,986-28-6936,172.21.15.191,Male,1979-10-29,90276,140000,,60,0.25,38125,False,,,algorithm_risk_score,,,gary.martinez58@protonmail.com,False,False,Male,False,False,False,1979-10-29,False,False,False,90276,False,,False,False,annual_income,140000.0,False,False,False,False,False,60,False,False,False,0.25,False,False,False,38125.0,False,,,algorithm_risk_score,False,False,False,False,True,False,False,False,False,False,False,False,False,False,False,False,False,False,False,False,False,False,True,False,1,1,True,False,unique,missing_or_unparseable_timestamp_fallback_max_row_id
112,app_297,,Daniel Green,daniel.green70@gmail.com,845-77-4845,172.29.27.236,Male,02/18/1983,10028,81000,,84,0.38,30102,True,3.5,58000.0,,,,daniel.green70@gmail.com,False,False,Male,False,False,False,1983-02-18,False,False,False,10028,False,,False,False,annual_income,81000.0,False,False,False,False,False,84,False,False,False,0.38,False,False,False,30102.0,True,3.5,58000.0,,False,False,False,False,True,False,False,False,False,False,False,True,False,False,False,False,False,False,False,False,False,False,True,False,1,1,True,False,unique,missing_or_unparseable_timestamp_fallback_max_row_id
113,app_223,,Edward Nguyen,edward.nguyen90@yahoo.com,728-35-5170,10.162.20.136,Male,2000/12/28,10040,57000,,0,0.26,4528,True,5.1,40000.0,,medical,,edward.nguyen90@yahoo.com,False,False,Male,False,False,False,2000-12-28,False,False,False,10040,False,,False,False,annual_income,57000.0,False,False,False,False,False,0,False,False,False,0.26,False,False,False,4528.0,True,5.1,40000.0,,False,False,True,True,True,False,False,False,False,False,False,True,False,False,False,False,False,False,False,False,True,True,True,False,1,1,True,False,unique,missing_or_unparseable_timestamp_fallback_max_row_id
114,app_052,,Kenneth Campbell,kenneth.campbell16@protonmail.com,255-10-9021,192.168.174.67,Male,1965-05-05,10052,91000,,119,0.11,38008,True,3.0,22000.0,,,,kenneth.campbell16@protonmail.com,False,False,Male,False,False,False,1965-05-05,False,False,False,10052,False,,False,False,annual_income,91000.0,False,False,False,False,False,119,False,False,False,0.11,False,False,False,38008.0,True,3.0,22000.0,,False,False,False,False,True,False,False,False,False,False,False,False,False,False,False,False,False,False,False,False,False,False,True,False,1,1,True,False,unique,missing_or_unparseable_timestamp_fallback_max_row_id
115,app_261,,Raymond Hall,raymond.hall45@hotmail.com,129-78-7265,10.137.212.135,M,12/28/1972,10041,63000,,59,0.38,23287,False,,,algorithm_risk_score,,,raymond.hall45@hotmail.com,False,False,Male,False,False,True,1972-12-28,False,False,False,10041,False,,False,False,annual_income,63000.0,False,False,False,False,False,59,False,False,False,0.38,False,False,False,23287.0,False,,,algorithm_risk_score,False,False,False,False,True,False,False,False,False,True,False,True,False,False,False,False,False,False,False,False,False,False,True,False,1,1,True,False,unique,missing_or_unparseable_timestamp_fallback_max_row_id
116,app_407,,Jacob Ramirez,jacob.ramirez30@aol.com,458-36-1005,192.168.53.145,Male,1990/11/09,10076,74000,,31,0.26,32341,False,,,algorithm_risk_score,,,jacob.ramirez30@aol.com,False,False,Male,False,False,False,1990-11-09,False,False,False,10076,False,,False,False,annual_income,74000.0,False,False,False,False,False,31,False,False,False,0.26,False,False,False,32341.0,False,,,algorithm_risk_score,False,False,False,False,True,False,False,False,False,False,False,True,False,False,False,False,False,False,False,False,False,False,True,False,1,1,True,False,unique,missing_or_unparseable_timestamp_fallback_max_row_id
117,app_014,,Pamela Gonzalez,pamela.gonzalez4@mail.com,622-41-3198,192.168.120.82,Female,14/01/1995,10086,112000,,35,0.45,9647,False,,,algorithm_risk_score,,,pamela.gonzalez4@mail.com,False,False,Female,False,False,False,1995-01-14,False,False,False,10086,False,,False,False,annual_income,112000.0,False,False,False,False,False,35,False,False,False,0.45,False,False,False,9647.0,False,,,algorithm_risk_score,False,False,False,False,True,False,False,False,False,False,False,True,False,False,False,False,False,False,False,False,False,False,True,False,1,1,True,False,unique,missing_or_unparseable_timestamp_fallback_max_row_id
118,app_143,2024-01-15T00:00:00Z,David Wilson,david.wilson94@hotmail.com,855-76-9652,192.168.180.240,Male,1958-12-21,10048,66000,,113,0.28,23503,True,6.4,66000.0,,,,david.wilson94@hotmail.com,False,False,Male,False,False,False,1958-12-21,False,False,False,10048,False,2024-01-15T00:00:00Z,False,False,annual_income,66000.0,False,False,False,False,False,113,False,False,False,0.28,False,False,False,23503.0,True,6.4,66000.0,,False,False,False,False,False,False,False,False,False,False,False,False,False,False,False,False,False,False,False,False,False,False,True,False,1,1,True,False,unique,latest_processing_timestamp
119,app_036,,Betty Hall,betty.hall38@hotmail.com,427-27-7779,10.141.198.139,Female,1988-03-31,90227,141000,,18,0.4,77318,True,3.3,49000.0,,,,betty.hall38@hotmail.com,False,False,Female,False,False,False,1988-03-31,False,False,False,90227,False,,False,False,annual_income,141000.0,False,False,False,False,False,18,False,False,False,0.4,False,False,False,77318.0,True,3.3,49000.0,,False,False,False,False,True,False,False,False,False,False,False,False,False,False,False,False,False,False,False,False,False,False,True,False,1,1,True,False,unique,missing_or_unparseable_timestamp_fallback_max_row_id
120,app_145,2024-01-15T00:00:00Z,Carolyn Robinson,carolyn.robinson18@outlook.com,887-80-6350,10.99.68.231,Female,04/10/1990,90297,85000,,26,0.43,17930,False,,,algorithm_risk_score,,,carolyn.robinson18@outlook.com,False,False,Female,False,False,False,1990-04-10,True,False,False,90297,False,2024-01-15T00:00:00Z,False,False,annual_income,85000.0,False,False,False,False,False,26,False,False,False,0.43,False,False,False,17930.0,False,,,algorithm_risk_score,False,False,False,False,False,False,False,False,False,False,False,True,True,False,False,False,False,False,False,False,False,False,True,False,1,1,True,False,unique,latest_processing_timestamp
121,app_128,,Thomas Scott,thomas.scott58@mail.com,857-88-7567,10.5.184.205,Male,1985-04-02,10078,94000,,81,0.4,73842,False,,,high_dti_ratio,,,thomas.scott58@mail.com,False,False,Male,False,False,False,1985-04-02,False,False,False,10078,False,,False,False,annual_income,94000.0,False,False,False,False,False,81,False,False,False,0.4,False,False,False,73842.0,False,,,high_dti_ratio,False,False,False,False,True,False,False,False,False,False,False,False,False,False,False,False,False,False,False,False,False,False,True,False,1,1,True,False,unique,missing_or_unparseable_timestamp_fallback_max_row_id
122,app_016,,Gary Wilson,gary.wilson85@yahoo.com,780-24-9300,192.168.20.42,M,1959-12-11,10091,123000,,71,0.37,86599,False,,,algorithm_risk_score,,,gary.wilson85@yahoo.com,False,False,Male,False,False,True,1959-12-11,False,False,False,10091,False,,False,False,annual_income,123000.0,False,False,False,False,False,71,False,False,False,0.37,False,False,False,86599.0,False,,,algorithm_risk_score,False,False,False,False,True,False,False,False,False,True,False,False,False,False,False,False,False,False,False,False,False,False,True,False,1,1,True,False,unique,missing_or_unparseable_timestamp_fallback_max_row_id
123,app_144,2024-01-15T00:00:00Z,Nicholas Taylor,nicholas.taylor14@icloud.com,745-28-4842,10.176.136.112,Male,1996-09-14,10024,56000,,0,0.27,23970,True,6.2,39000.0,,,,nicholas.taylor14@icloud.com,False,False,Male,False,False,False,1996-09-14,False,False,False,10024,False,2024-01-15T00:00:00Z,False,False,annual_income,56000.0,False,False,False,False,False,0,False,False,False,0.27,False,False,False,23970.0,True,6.2,39000.0,,False,False,True,True,False,False,False,False,False,False,False,False,False,False,False,False,False,False,False,False,True,True,True,False,1,1,True,False,unique,latest_processing_timestamp
124,app_134,,Brandon Moore,brandon.moore99@aol.com,714-64-1550,10.236.143.233,Male,06/10/1993,10048,98000,,60,0.12,24889,True,6.0,69000.0,,,,brandon.moore99@aol.com,False,False,Male,False,False,False,1993-06-10,True,False,False,10048,False,,False,False,annual_income,98000.0,False,False,False,False,False,60,False,False,False,0.12,False,False,False,24889.0,True,6.0,69000.0,,False,False,False,False,True,False,False,False,False,False,False,True,True,False,False,False,False,False,False,False,False,False,True,False,1,1,True,False,unique,missing_or_unparseable_timestamp_fallback_max_row_id
125,app_238,,Andrew Carter,andrew.carter41@protonmail.com,760-94-9485,10.39.210.182,Male,11/03/1988,10057,131000,,112,0.17,65612,False,,,algorithm_risk_score,business,,andrew.carter41@protonmail.com,False,False,Male,False,False,False,1988-11-03,True,False,False,10057,False,,False,False,annual_income,131000.0,False,False,False,False,False,112,False,False,False,0.17,False,False,False,65612.0,False,,,algorithm_risk_score,False,False,False,False,True,False,False,False,False,False,False,True,True,False,False,False,False,False,False,False,False,False,True,False,1,1,True,False,unique,missing_or_unparseable_timestamp_fallback_max_row_id
126,app_270,,Debra Flores,debra.flores69@protonmail.com,911-30-4999,172.24.233.43,Female,1993-10-19,10098,58000,,78,0.24,14687,False,,,algorithm_risk_score,,,debra.flores69@protonmail.com,False,False,Female,False,False,False,1993-10-19,False,False,False,10098,False,,False,False,annual_income,58000.0,False,False,False,False,False,78,False,False,False,0.24,False,False,False,14687.0,False,,,algorithm_risk_score,False,False,False,False,True,False,False,False,False,False,False,False,False,False,False,False,False,False,False,False,False,False,True,False,1,1,True,False,unique,missing_or_unparseable_timestamp_fallback_max_row_id
127,app_151,2024-01-15T00:00:00Z,James Young,james.young39@outlook.com,582-51-4265,192.168.53.146,M,1988-01-11,10019,124000,,59,0.4,53225,False,,,algorithm_risk_score,,,james.young39@outlook.com,False,False,Male,False,False,True,1988-01-11,False,False,False,10019,False,2024-01-15T00:00:00Z,False,False,annual_income,124000.0,False,False,False,False,False,59,False,False,False,0.4,False,False,False,53225.0,False,,,algorithm_risk_score,False,False,False,False,False,False,False,False,False,True,False,False,False,False,False,False,False,False,False,False,False,False,True,False,1,1,True,False,unique,latest_processing_timestamp
128,app_382,,Charles White,charles.white70@aol.com,160-88-7527,192.168.185.92,Male,1994-10-01,10091,102000,,12,0.42,26781,True,5.8,22000.0,,,,charles.white70@aol.com,False,False,Male,False,False,False,1994-10-01,False,False,False,10091,False,,False,False,annual_income,102000.0,False,False,False,False,False,12,False,False,False,0.42,False,False,False,26781.0,True,5.8,22000.0,,False,False,False,False,True,False,False,False,False,False,False,False,False,False,False,False,False,False,False,False,False,False,True,False,1,1,True,False,unique,missing_or_unparseable_timestamp_fallback_max_row_id
129,app_351,2025-12-01T00:00:00Z,Gary Young,gary.young30@outlook.com,542-27-3301,10.156.74.115,Male,1995-04-14,30029,67000,,9,0.12,26062,False,,,algorithm_risk_score,,,gary.young30@outlook.com,False,False,Male,False,False,False,1995-04-14,False,False,False,30029,False,2025-12-01T00:00:00Z,False,False,annual_income,67000.0,False,False,False,False,False,9,False,False,False,0.12,False,False,False,26062.0,False,,,algorithm_risk_score,False,False,False,False,False,False,False,False,False,False,False,False,False,False,False,False,False,False,False,False,False,False,True,False,1,1,True,False,unique,latest_processing_timestamp
130,app_071,,Debra Wilson,debra.wilson10@mail.com,542-49-2109,192.168.24.61,F,1978-02-03,90208,134000,,69,0.07,72178,True,3.8,54000.0,,,,debra.wilson10@mail.com,False,False,Female,False,False,True,1978-02-03,False,False,False,90208,False,,False,False,annual_income,134000.0,False,False,False,False,False,69,False,False,False,0.07,False,False,False,72178.0,True,3.8,54000.0,,False,False,False,False,True,False,False,False,False,True,False,False,False,False,False,False,False,False,False,False,False,False,True,False,1,1,True,False,unique,missing_or_unparseable_timestamp_fallback_max_row_id
131,app_057,,Betty Smith,betty.smith71@yahoo.com,848-93-7847,10.30.94.229,Female,1990/11/08,90255,70000,,42,0.15,38800,True,2.5,55000.0,,,,betty.smith71@yahoo.com,False,False,Female,False,False,False,1990-11-08,False,False,False,90255,False,,False,False,annual_income,70000.0,False,False,False,False,False,42,False,False,False,0.15,False,False,False,38800.0,True,2.5,55000.0,,False,False,False,False,True,False,False,False,False,False,False,True,False,False,False,False,False,False,False,False,False,False,True,False,1,1,True,False,unique,missing_or_unparseable_timestamp_fallback_max_row_id
132,app_278,,Sarah Gonzalez,sarah.gonzalez66@yahoo.com,975-14-1465,10.133.35.59,Female,1997-05-21,10024,56000,,0,0.28,9221,False,,,algorithm_risk_score,,,sarah.gonzalez66@yahoo.com,False,False,Female,False,False,False,1997-05-21,False,False,False,10024,False,,False,False,annual_income,56000.0,False,False,False,False,False,0,False,False,False,0.28,False,False,False,9221.0,False,,,algorithm_risk_score,False,False,False,False,True,False,False,False,False,False,False,False,False,False,False,False,False,False,False,False,False,False,True,False,1,1,True,False,unique,missing_or_unparseable_timestamp_fallback_max_row_id
133,app_391,,Jeffrey Perez,jeffrey.perez3@outlook.com,749-47-1082,192.168.93.38,Male,29/03/1963,10044,69000,,131,0.19,37029,True,4.9,65000.0,,,,jeffrey.perez3@outlook.com,False,False,Male,False,False,False,1963-03-29,False,False,False,10044,False,,False,False,annual_income,69000.0,False,False,False,False,False,131,False,False,False,0.19,False,False,False,37029.0,True,4.9,65000.0,,False,False,False,False,True,False,False,False,False,False,False,True,False,False,False,False,False,False,False,False,False,False,True,False,1,1,True,False,unique,missing_or_unparseable_timestamp_fallback_max_row_id
134,app_271,,Katherine Lopez,katherine.lopez84@gmail.com,696-78-1129,192.168.120.3,Female,07/28/1988,90273,95000,,44,0.35,34950,True,5.8,17000.0,,,,katherine.lopez84@gmail.com,False,False,Female,False,False,False,1988-07-28,False,False,False,90273,False,,False,False,annual_income,95000.0,False,False,False,False,False,44,False,False,False,0.35,False,False,False,34950.0,True,5.8,17000.0,,False,False,False,False,True,False,False,False,False,False,False,True,False,False,False,False,False,False,False,False,False,False,True,False,1,1,True,False,unique,missing_or_unparseable_timestamp_fallback_max_row_id
135,app_170,2024-01-15T00:00:00Z,Ryan Lopez,ryan.lopez76@outlook.com,907-21-8853,10.160.161.230,Male,1990-02-19,30015,75000,,40,0.18,10709,True,3.3,79000.0,,,,ryan.lopez76@outlook.com,False,False,Male,False,False,False,1990-02-19,False,False,False,30015,False,2024-01-15T00:00:00Z,False,False,annual_income,75000.0,False,False,False,False,False,40,False,False,False,0.18,False,False,False,10709.0,True,3.3,79000.0,,False,False,False,False,False,False,False,False,False,False,False,False,False,False,False,False,False,False,False,False,False,False,True,False,1,1,True,False,unique,latest_processing_timestamp
136,app_005,,Christine Mitchell,christine.mitchell3@outlook.com,400-91-8156,172.25.44.173,Female,1960/06/19,90296,39000,,76,0.06,15011,False,,,algorithm_risk_score,,,christine.mitchell3@outlook.com,False,False,Female,False,False,False,1960-06-19,False,False,False,90296,False,,False,False,annual_income,39000.0,False,False,False,False,False,76,False,False,False,0.06,False,False,False,15011.0,False,,,algorithm_risk_score,False,False,False,False,True,False,False,False,False,False,False,True,False,False,False,False,False,False,False,False,False,False,True,False,1,1,True,False,unique,missing_or_unparseable_timestamp_fallback_max_row_id
137,app_043,,Daniel King,daniel.king27@mail.com,166-23-2000,10.204.248.60,Male,1985-08-17,10038,131000,,-10,0.06,53098,True,3.9,68000.0,,,,daniel.king27@mail.com,False,False,Male,False,False,False,1985-08-17,False,False,False,10038,False,,False,False,annual_income,131000.0,False,False,False,True,True,,False,False,False,0.06,False,False,False,53098.0,True,3.9,68000.0,,False,False,,,True,False,False,False,False,False,False,False,False,False,False,True,False,False,False,False,False,True,True,False,1,1,True,False,unique,missing_or_unparseable_timestamp_fallback_max_row_id
138,app_204,,Jonathan Carter,mike johnson@gmail.com,972-81-1928,10.77.72.174,Male,1983-04-12,90256,81000,,63,0.22,14018,False,,,algorithm_risk_score,vacation,,mike johnson@gmail.com,False,True,Male,False,False,False,1983-04-12,False,False,False,90256,False,,False,False,annual_income,81000.0,False,False,False,False,False,63,False,False,False,0.22,False,False,False,14018.0,False,,,algorithm_risk_score,False,False,False,False,True,False,False,False,True,False,False,False,False,False,False,False,False,False,False,False,False,False,True,False,1,1,True,False,unique,missing_or_unparseable_timestamp_fallback_max_row_id
139,app_465,,James Rivera,james.rivera15@outlook.com,853-96-1952,192.168.175.28,Male,1972-05-29,10041,72000,,89,0.32,27863,True,5.7,20000.0,,,,james.rivera15@outlook.com,False,False,Male,False,False,False,1972-05-29,False,False,False,10041,False,,False,False,annual_income,72000.0,False,False,False,False,False,89,False,False,False,0.32,False,False,False,27863.0,True,5.7,20000.0,,False,False,False,False,True,False,False,False,False,False,False,False,False,False,False,False,False,False,False,False,False,False,True,False,1,1,True,False,unique,missing_or_unparseable_timestamp_fallback_max_row_id
140,app_448,,Susan Flores,susan.flores60@mail.com,383-48-9078,172.26.210.172,Female,1983-12-17,90221,57000,,22,0.23,12120,True,6.4,47000.0,,,,susan.flores60@mail.com,False,False,Female,False,False,False,1983-12-17,False,False,False,90221,False,,False,False,annual_income,57000.0,False,False,False,False,False,22,False,False,False,0.23,False,False,False,12120.0,True,6.4,47000.0,,False,False,False,False,True,False,False,False,False,False,False,False,False,False,False,False,False,False,False,False,False,False,True,False,1,1,True,False,unique,missing_or_unparseable_timestamp_fallback_max_row_id
141,app_463,,Emma Clark,emma.clark61@outlook.com,976-47-3536,10.194.129.196,Female,1975-04-26,90205,,86000.0,50,0.29,66878,False,,,algorithm_risk_score,,,emma.clark61@outlook.com,False,False,Female,False,False,False,1975-04-26,False,False,False,90205,False,,False,True,annual_salary,86000.0,False,False,False,False,False,50,False,False,False,0.29,False,False,False,66878.0,False,,,algorithm_risk_score,False,False,False,False,True,False,False,False,False,False,False,False,False,False,True,False,False,False,False,False,False,False,True,False,1,1,True,False,unique,missing_or_unparseable_timestamp_fallback_max_row_id
142,app_109,,Anna Davis,anna.davis94@mail.com,239-98-1268,10.105.58.146,Female,2000-01-03,90278,47000,,27,0.23,17289,True,4.0,17000.0,,,,anna.davis94@mail.com,False,False,Female,False,False,False,2000-01-03,False,False,False,90278,False,,False,False,annual_income,47000.0,False,False,False,False,False,27,False,False,False,0.23,False,False,False,17289.0,True,4.0,17000.0,,False,False,False,False,True,False,False,False,False,False,False,False,False,False,False,False,False,False,False,False,False,False,True,False,1,1,True,False,unique,missing_or_unparseable_timestamp_fallback_max_row_id
143,app_444,,Brandon Brown,brandon.brown2@hotmail.com,761-72-9912,10.4.242.163,Male,1981/10/28,10077,91000,,56,0.23,28670,True,5.5,59000.0,,,,brandon.brown2@hotmail.com,False,False,Male,False,False,False,1981-10-28,False,False,False,10077,False,,False,False,annual_income,91000.0,False,False,False,False,False,56,False,False,False,0.23,False,False,False,28670.0,True,5.5,59000.0,,False,False,False,False,True,False,False,False,False,False,False,True,False,False,False,False,False,False,False,False,False,False,True,False,1,1,True,False,unique,missing_or_unparseable_timestamp_fallback_max_row_id
144,app_412,,Alexander Wright,alexander.wright47@hotmail.com,912-89-2986,10.158.159.60,Male,1997-02-16,10096,53000,,61,0.43,25452,False,,,high_dti_ratio,,,alexander.wright47@hotmail.com,False,False,Male,False,False,False,1997-02-16,False,False,False,10096,False,,False,False,annual_income,53000.0,False,False,False,False,False,61,False,False,False,0.43,False,False,False,25452.0,False,,,high_dti_ratio,False,False,False,False,True,False,False,False,False,False,False,False,False,False,False,False,False,False,False,False,False,False,True,False,1,1,True,False,unique,missing_or_unparseable_timestamp_fallback_max_row_id
145,app_092,,Linda Jones,linda.jones69@hotmail.com,671-44-4118,10.218.56.39,Female,1997-09-29,90222,22000,,31,0.4,14473,True,5.5,29000.0,,,,linda.jones69@hotmail.com,False,False,Female,False,False,False,1997-09-29,False,False,False,90222,False,,False,False,annual_income,22000.0,False,False,False,False,False,31,False,False,False,0.4,False,False,False,14473.0,True,5.5,29000.0,,False,False,False,False,True,False,False,False,False,False,False,False,False,False,False,False,False,False,False,False,False,False,True,False,1,1,True,False,unique,missing_or_unparseable_timestamp_fallback_max_row_id
146,app_135,,Laura Wilson,laura.wilson90@outlook.com,754-90-5869,10.172.73.55,Female,1986-10-23,90202,65000,,92,0.22,9369,False,,,algorithm_risk_score,,,laura.wilson90@outlook.com,False,False,Female,False,False,False,1986-10-23,False,False,False,90202,False,,False,False,annual_income,65000.0,False,False,False,False,False,92,False,False,False,0.22,False,False,False,9369.0,False,,,algorithm_risk_score,False,False,False,False,True,False,False,False,False,False,False,False,False,True,False,False,False,False,False,False,False,False,True,False,1,1,True,False,unique,missing_or_unparseable_timestamp_fallback_max_row_id
147,app_104,,Maria Adams,maria.adams22@aol.com,186-65-7168,10.130.39.7,Female,1972-09-25,90254,84000,,85,0.35,32846,True,3.6,76000.0,,,,maria.adams22@aol.com,False,False,Female,False,False,False,1972-09-25,False,False,False,90254,False,,False,False,annual_income,84000.0,False,False,False,False,False,85,False,False,False,0.35,False,False,False,32846.0,True,3.6,76000.0,,False,False,False,False,True,False,False,False,False,False,False,False,False,False,False,False,False,False,False,False,False,False,True,False,1,1,True,False,unique,missing_or_unparseable_timestamp_fallback_max_row_id
148,app_394,,Karen Robinson,karen.robinson34@gmail.com,949-81-1792,192.168.66.232,Female,1998-09-02,90271,61000,,54,0.16,16646,False,,,algorithm_risk_score,,,karen.robinson34@gmail.com,False,False,Female,False,False,False,1998-09-02,False,False,False,90271,False,,False,False,annual_income,61000.0,False,False,False,False,False,54,False,False,False,0.16,False,False,False,16646.0,False,,,algorithm_risk_score,False,False,False,False,True,False,False,False,False,False,False,False,False,False,False,False,False,False,False,False,False,False,True,False,1,1,True,False,unique,missing_or_unparseable_timestamp_fallback_max_row_id
149,app_449,,Lisa Roberts,lisa.roberts99@outlook.com,833-71-7935,172.23.144.234,Female,1968-11-09,90234,,75000.0,86,0.07,27467,True,5.7,54000.0,,,,lisa.roberts99@outlook.com,False,False,Female,False,False,False,1968-11-09,False,False,False,90234,False,,False,True,annual_salary,75000.0,False,False,False,False,False,86,False,False,False,0.07,False,False,False,27467.0,True,5.7,54000.0,,False,False,False,False,True,False,False,False,False,False,False,False,False,False,True,False,False,False,False,False,False,False,True,False,1,1,True,False,unique,missing_or_unparseable_timestamp_fallback_max_row_id
150,app_255,,Larry Ramirez,larry.ramirez85@mail.com,646-37-3934,192.168.14.184,Male,1991/08/05,10083,59000,,32,0.07,13853,True,4.8,55000.0,,,,larry.ramirez85@mail.com,False,False,Male,False,False,False,1991-08-05,False,False,False,10083,False,,False,False,annual_income,59000.0,False,False,False,False,False,32,False,False,False,0.07,False,False,False,13853.0,True,4.8,55000.0,,False,False,False,False,True,False,False,False,False,False,False,True,False,False,False,False,False,False,False,False,False,False,True,False,1,1,True,False,unique,missing_or_unparseable_timestamp_fallback_max_row_id
151,app_365,,Donald Ramirez,donald.ramirez2@protonmail.com,639-74-5472,192.168.85.102,M,1989-04-20,10043,79000,,53,0.08,10899,True,2.6,29000.0,,,,donald.ramirez2@protonmail.com,False,False,Male,False,False,True,1989-04-20,False,False,False,10043,False,,False,False,annual_income,79000.0,False,False,False,False,False,53,False,False,False,0.08,False,False,False,10899.0,True,2.6,29000.0,,False,False,False,False,True,False,False,False,False,True,False,False,False,False,False,False,False,False,False,False,False,False,True,False,1,1,True,False,unique,missing_or_unparseable_timestamp_fallback_max_row_id
152,app_500,,Gregory Robinson,gregory.robinson44@gmail.com,195-84-3232,192.168.9.203,M,1991-02-27,10048,86000,,12,0.13,42908,True,5.2,38000.0,,,,gregory.robinson44@gmail.com,False,False,Male,False,False,True,1991-02-27,False,False,False,10048,False,,False,False,annual_income,86000.0,False,False,False,False,False,12,False,False,False,0.13,False,False,False,42908.0,True,5.2,38000.0,,False,False,False,False,True,False,False,False,False,True,False,False,False,False,False,False,False,False,False,False,False,False,True,False,1,1,True,False,unique,missing_or_unparseable_timestamp_fallback_max_row_id
153,app_110,,Mark Campbell,mark.campbell54@icloud.com,223-83-4934,192.168.251.236,Male,1962-07-07,10011,111000,,112,0.07,58086,True,3.4,78000.0,,,,mark.campbell54@icloud.com,False,False,Male,False,False,False,1962-07-07,False,False,False,10011,False,,False,False,annual_income,111000.0,False,False,False,False,False,112,False,False,False,0.07,False,False,False,58086.0,True,3.4,78000.0,,False,False,False,False,True,False,False,False,False,False,False,False,False,False,False,False,False,False,False,False,False,False,True,False,1,1,True,False,unique,missing_or_unparseable_timestamp_fallback_max_row_id
154,app_335,,Matthew Johnson,matthew.johnson43@protonmail.com,520-53-3058,10.184.100.56,Male,29/01/1977,10092,83000,,75,0.16,57065,True,3.9,24000.0,,,,matthew.johnson43@protonmail.com,False,False,Male,False,False,False,1977-01-29,False,False,False,10092,False,,False,False,annual_income,83000.0,False,False,False,False,False,75,False,False,False,0.16,False,False,False,57065.0,True,3.9,24000.0,,False,False,False,False,True,False,False,False,False,False,False,True,False,False,False,False,False,False,False,False,False,False,True,False,1,1,True,False,unique,missing_or_unparseable_timestamp_fallback_max_row_id
155,app_490,,Catherine King,catherine.king79@gmail.com,305-93-9799,172.29.194.13,Female,1987/04/13,90251,171000,,74,0.26,45864,False,,,algorithm_risk_score,,,catherine.king79@gmail.com,False,False,Female,False,False,False,1987-04-13,False,False,False,90251,False,,False,False,annual_income,171000.0,False,False,False,False,False,74,False,False,False,0.26,False,False,False,45864.0,False,,,algorithm_risk_score,False,False,False,False,True,False,False,False,False,False,False,True,False,False,False,False,False,False,False,False,False,False,True,False,1,1,True,False,unique,missing_or_unparseable_timestamp_fallback_max_row_id
156,app_258,,Laura Thompson,laura.thompson44@protonmail.com,112-40-9635,10.248.44.99,Female,1975-04-14,90273,71000,,119,0.19,21151,True,6.5,73000.0,,,,laura.thompson44@protonmail.com,False,False,Female,False,False,False,1975-04-14,False,False,False,90273,False,,False,False,annual_income,71000.0,False,False,False,False,False,119,False,False,False,0.19,False,False,False,21151.0,True,6.5,73000.0,,False,False,False,False,True,False,False,False,False,False,False,False,False,False,False,False,False,False,False,False,False,False,True,False,1,1,True,False,unique,missing_or_unparseable_timestamp_fallback_max_row_id
157,app_262,,Lisa Nelson,lisa.nelson41@protonmail.com,141-88-9385,172.31.49.104,F,1999-09-28,90264,46000,,38,0.09,18075,False,,,algorithm_risk_score,,,lisa.nelson41@protonmail.com,False,False,Female,False,False,True,1999-09-28,False,False,False,90264,False,,False,False,annual_income,46000.0,False,False,False,False,False,38,False,False,False,0.09,False,False,False,18075.0,False,,,algorithm_risk_score,False,False,False,False,True,False,False,False,False,True,False,False,False,False,False,False,False,False,False,False,False,False,True,False,1,1,True,False,unique,missing_or_unparseable_timestamp_fallback_max_row_id
158,app_303,,Catherine Smith,catherine.smith85@outlook.com,961-32-4455,192.168.65.3,Female,1998-03-12,90281,41000,,67,0.41,9650,False,,,algorithm_risk_score,,,catherine.smith85@outlook.com,False,False,Female,False,False,False,1998-03-12,False,False,False,90281,False,,False,False,annual_income,41000.0,False,False,False,False,False,67,False,False,False,0.41,False,False,False,9650.0,False,,,algorithm_risk_score,False,False,False,False,True,False,False,False,False,False,False,False,False,False,False,False,False,False,False,False,False,False,True,False,1,1,True,False,unique,missing_or_unparseable_timestamp_fallback_max_row_id
159,app_290,,Stephanie Perez,stephanie.perez69@gmail.com,866-48-3726,172.25.130.219,Female,1990-01-06,90221,104000,,39,0.27,-5000,True,4.3,49000.0,,,,stephanie.perez69@gmail.com,False,False,Female,False,False,False,1990-01-06,False,False,False,90221,False,,False,False,annual_income,104000.0,False,False,False,False,False,39,False,False,False,0.27,False,True,True,,True,4.3,49000.0,,False,False,False,False,True,False,False,False,False,False,False,False,False,False,False,False,True,False,False,False,False,False,True,False,1,1,True,False,unique,missing_or_unparseable_timestamp_fallback_max_row_id
